comment_id,user_name,text_raw,source,like_counts,created_at
3224,Jamanman吖,现实中你这种档次的只能配一个中低等的普通人 你好好知足吧吃绝户 有钱有爱有娃有知名度,广东,3,24-11-19 20:47
3225,Jamanman吖,你到底在委屈什么啊 你是好命 现实中贤惠淑德善良温柔的比比皆是 很多还不会投胎 每天为生计奔命 老公还不看在眼里只把一切当理所当然 你呢 掌握财政大权 老公对你各种爱的呵护 你非要通过打压人获得自己的满足感优越感 钱都在你那要什么奢侈品？李行亮把命卖了吗？身材走形邋里邋遢这些别怪婚姻,广东,4,24-11-19 20:46
3226,Jamanman吖,做个人吧 太可恨了 双标女 自大女 npd 卖弱装惨 空心人,广东,2,24-11-19 20:42
3227,Jamanman吖,吃人不见血 你真可怕,广东,1,24-11-19 20:42
3228,阿瑶的小蝴蝶1o,丢人不？阿姨,湖南,7,24-11-19 20:35
3229,Jessie-Chen嘉欣,看到你就想开骂,广东,0,24-11-19 20:23
3230,鬼市猪精,网暴不对，但你确实太烂了,上海,2,24-11-19 20:18
3231,鬼市猪精,你看看你的条件，哪一点能够上男方啊怎么敢pua的啊要不是找不到接盘的你早把他踹了对吧,上海,2,24-11-19 20:15
3232,欢颜Lqz,好好珍惜身边人吧 李行亮对你多好呀 PUA 可不好,辽宁,0,24-11-19 20:12
3233,祝愿5901,你上节目一天笑nmu呢,云南,0,24-11-19 20:11
3234,是淇是妻,你现在已经火了，可以去直播卖货，只有掌握了权力 才能明白容貌焦虑和别的焦虑都无所谓，要钱，让别人讨厌你的实力也是实力，因为你可以赚到数百万的钱，怎么不算有实力，我希望看到你重新焕发的样子，没关系的，要知道 以你的名气现在的李行亮是配不上你，因为他无法赚到和你一样的钱，你有很大的价值,山东,1,24-11-19 20:05
3235,爱芝士爱抹茶的皮皮,感觉你就是太闲了，在家里做全职妈妈确实很辛苦，把全部精力放在了家人身上就会失去自我，从而觉得别人亏欠，其实这个缩影在很多人身上都有，还有一点大概就还是觉得不够富有，跟人攀比,广东,1,24-11-19 19:47
3236,陪我去热带生活,求你快点离开亮亮吧,辽宁,0,24-11-19 19:42
3237,经济基础决定热爱强度,你真可怕,内蒙古,5,24-11-19 19:34
3238,小和Aaaa,就这样网暴一个素人….,海南,10,24-11-19 19:33
3239,飘来荡去199104,看了这么多评论，我心里终于舒服些了，这么作的女人，我第一次见，真是害人不浅,广东,0,24-11-19 19:28
3240,EVertimt,你到底在委屈什么啊 哭三个小时,四川,0,24-11-19 19:25
3242,懂火火_,我觉得谁找你谁眼瞎，你赶快离开李行亮吧，你就像个鬼缠身，恶魔知道嘛，依附在别人身上，吃别人喝别人的别人还带着你过上好日子，别说以前自己了不起，你就是没有上进心还贪婪，欺辱那个挣饭给你吃的人，当别人有所觉醒的时候最后你还狠毒让李行亮一无所有，你是个什么玩意啊？请问,江苏,1,24-11-19 19:14
3243,李星星Mickey,无语李行亮好可怜,海南,2,24-11-19 19:12
3244,好吧_我是若小佳,朋友借你们钱，你还嫌少跑去骂朋友，你真的是个人才啊,上海,2,24-11-19 19:06
3245,G梓彤,姐因为你我硬生生的把杨子看顺眼了 你真厉害,江苏,2,24-11-19 19:06
3246,用户7832212514,你们别说她配不上富豪啊，她没了这个幻想怎么放过亮哥呀，你配得上，快离了，快去找！,云南,0,24-11-19 19:04
3247,被幸运砸破头的zy666,可以配拥有一杯咖啡吗？阴阳怪气的，你明知道配不上李行亮怎么不离呢？一天哭800回,广东,2,24-11-19 18:48
3248,IceChickenZero,唐氏综合征长相,山东,0,24-11-19 18:45
3249,百色康盛健康体检中心小黄,你为什么要这样对别人,广西,1,24-11-19 18:26
3250,苏苏m老师,我想揍你的心又一次升到了顶峰,福建,2,24-11-19 18:10
3251,Highbury本人,麦琳 不要把网友的审判当回事 现在网友最擅长人云亦云 自我高潮,加拿大,10,24-11-19 18:04
3252,Jaa__,你每月赚个2k，3k就够了。赶紧离吧。别害人了,湖南,0,24-11-19 17:54
3253,Tian是勇敢辣妈,为了你自己，为了能让你自己生活有个质的飞跃，麻烦你赶紧和亮子离婚吧，别让他耽误你找富豪了，你人又美、又能干、又会赚钱，赶紧拜托亮子吧，他实在配不上你，你赶紧打包走人吧,江西,3,24-11-19 17:53
3254,手机用户3247036971,凭什么钱和孩子都归你呢？,江西,0,24-11-19 17:50
3255,杨冰月018,恭喜你啊，丢脸丢到国外去了希望你好好审视自己，重新做人。加油👏,日本,0,24-11-19 17:48
3256,7irap,你哪来的自信,湖南,0,24-11-19 17:41
3257,蒙塔基-钢蛋欧巴,如果不是剧本的话 你这个人真的是太让人反感了,河北,0,24-11-19 17:38
3258,江远夏,求你离婚,上海,1,24-11-19 17:35
3259,ab贝妞妞,多读点书吧,江苏,1,24-11-19 17:33
3260,这什么-我的了,别再买热搜，别再吃女性红利，少代表全体女性哈,浙江,2,24-11-19 17:17
3261,EMPTYZOOEY,心理不完整的人不适合在亲密关系里，李行亮也是人 需要被看到 被看到需求,浙江,1,24-11-19 17:16
3262,北猫南方,也就李行亮能让你拿捏了换个爷们儿，大巴掌都得亮你脸上,四川,1,24-11-19 17:14
3263,是37度,美貌性格智商情商一个不占，你不会真觉得杨子能看上你吧，人家爱花瓶不喜欢泔水桶,山西,14,24-11-19 17:07
3264,曾多次拒绝刘昊然,大妈长相 大妈思维,湖北,2,24-11-19 17:07
3265,emmandna,还是缺人治你 算你命好还有李惯着你 换个脾气差点的直接上手了,浙江,7,24-11-19 16:58
3266,小晗三岁半,姐姐想吃绝户就直说嘛,云南,3,24-11-19 16:28
3267,萱草每天幸福亿点点,看完第五期上，真的觉得你需要自己看下，改变一下。这样不是再见爱人，连朋友都不会有。,江苏,2,24-11-19 16:17
3268,吃葡萄的蒲公英,其实关于之前有钱人追你这个事 偶尔夫妻之间打打闹闹时候说一下也没啥。但吵架时候不能说。而且真相是。什么样水平的人就会找什么样的水平的人 ，其实夫妻之间大多是是匹配的 ，你们还是自由恋爱。每个人当下的选择一定是对自己最有利的选择。这和炒股差不多。不用做啥假设。,辽宁,2,24-11-19 16:16
3269,这就是歌姬吧,你中专毕业销售，年轻时长相也就普普通通。成天幻想自己当初可以嫁给有钱人。有钱人不是沙币，有钱人选的是黄圣依。懂吗,陕西,2,24-11-19 16:01
3270,梦到你的怪蜀黍,我一集没看，气没少受，你怎么做到的,广东,5,24-11-19 15:59
3271,祝小小101,麦琳姐你好，我看了您的节目对您的经历我表示非常心痛，借用付航的一句话，勇敢做自己总会有人去爱你加油麦琳姐,辽宁,1,24-11-19 15:53
3272,爱笑的難过,傅首尔长相果然名不虚传,江苏,2,24-11-19 15:43
3273,Sunrie0405,👻👻👻,加拿大,0,24-11-19 14:42
3274,lucyccyy,你是我全网最讨厌的人都没有之一,福建,12,24-11-19 14:38
3275,很美的精神状态ing,plq骂你的蝻的是太渴嘿割弔了你别生气就原谅一下他们吧,江苏,2,24-11-19 14:37
3276,躲在BC的小胖子,哈哈哈哈,浙江,0,24-11-19 14:30
3277,卖翡翠的猛子,专门下载个微博来看看你评论区，看到网友都挺清醒就好～你到底想要什么你自己都不知道吧……真的从来没有这么厌恶过一个陌生人,缅甸,1,24-11-19 14:28
3278,Sherry圆圆8,1,广东,0,24-11-19 14:25
3279,道长天咋黑了,真的，你是怎么能想出问亮亮，让把财产都给你，虽然你生了孩子，你当了家庭主妇，但那是你自己选择的路，你回头来道德绑架亮亮还想着让人家净身出户，你搞搞清楚，你现在的吃穿住，不出所料的话，应该都是亮亮挣的钱吧人把财政大权都交给你了，你好好在家过日子不好吗？非得作！,陕西,3,24-11-19 14:19
3281,陈陈的banana,你tm，e心的女人，心里面是黑的！你跟李行亮两个人慢慢虐慢慢play！别欺负我们葛夕！无语了！,广东,4,24-11-19 13:53
3282,阳光彩虹小_花花,怎么只有19年的,上海,1,24-11-19 13:48
3283,多一点点善意_,心疼你，从一个光鲜亮丽的小美女变成现在一个黄脸婆,浙江,2,24-11-19 13:44
3284,可以叫我熙苒,真是相由心生,广东,0,24-11-19 13:41
3285,半枝桃1号,人间少有的奇葩 多反思一下自己 少责怪他人 别人不欠你的 虚伪至极 又双标又爱破防 梦到哪句说哪句 出去找个班上吧 离谱,福建,0,24-11-19 13:36
3286,whoiszuikude,八戒八戒 心肠好坏,河南,2,24-11-19 13:34
3287,吧啦吧啦小胖脸,给你的真诚建议，找个工作，不要幻想没有发生的事情，李行亮真的被你折磨的快不是人了,安徽,0,24-11-19 13:33
3288,是土土小呀,讲点功德，别那么脏行吗？民宿老板都受不了你了！！！,河北,1,24-11-19 13:32
3289,Summerdudo,你真的是世间少有，奇葩！,美国,1,24-11-19 13:26
3290,乌木喂喂威恩耶吞温威乌湿穆扁,又不爱干净又自私，还胖,广东,1,24-11-19 13:24
3292,没蜡笔的小鑫___,第一次觉得一个人身上居然会毫无优点,四川,3,24-11-19 13:07
3293,阿源Redround,姐姐你还是呆家里吧，你出来会发现自己啥也不是,福建,1,24-11-19 13:06
3294,一只小嘟嘟DuDu,姐，你理解的亲密关系就是折磨对方吗？,新疆,5,24-11-19 12:58
3295,没力小欣,大家这是在网暴，她罪不至此,河南,2,24-11-19 12:58
3297,跑龙套甲乙,谢谢你了你帮了一众低血压人上高血压,江苏,2,24-11-19 12:56
3298,夏蓉采,你真的人品很差 家教也很差,上海,2,24-11-19 12:55
3300,反正关你屁事iiii,麦麦 调整心态，一切都会变好。,广东,0,24-11-19 12:51
3301,Hwwwwww1231,李行亮人一华科大才子，华科大多好的同学圈层人脉，被你毁了，你可真是 cs 啊,广西,0,24-11-19 12:51
3302,花花SZYH,奇葩,浙江,0,24-11-19 12:51
3303,言某可可,钱和孩子能不能都要,上海,0,24-11-19 12:47
3304,紫菜刺客,额,江西,0,24-11-19 12:46
3305,Julyly12sgfac,你纯纯的人品有大问题，已经不是单纯的自私了,广东,1,24-11-19 12:44
3306,WangMX000,你真的自我感觉良好,湖北,0,24-11-19 12:41
3307,亓秒鱼,姐，实在不行找个班上带货卖熏鸡吧,浙江,0,24-11-19 12:31
3308,一笼zeng饺,央媒都受不了的女人,江西,0,24-11-19 12:23
3309,糍饭二两,寄生虫🪱,上海,0,24-11-19 12:21
3310,我不想沉入海底,还搞各种洗白小文章？心都黑了的人怎么都洗不白,江苏,1,24-11-19 12:15
3311,ziweishengnv1987,无论颜值还是内修，你都不配得到爱,浙江,0,24-11-19 12:15
3312,何铭洪_,要去治一下，,广东,0,24-11-19 12:04
3313,是晗大蕾吖,让葛夕卖艺？触生,河北,0,24-11-19 12:01
3314,我是你爸爸车干,彪子,浙江,0,24-11-19 11:51
3315,滕搅直,一个女的怎么能这么邋遢,浙江,1,24-11-19 11:49
3316,错把老醋当墨写尽半生心酸,自我感觉良好,北京,0,24-11-19 11:47
3317,暗哑于秋kai,你赶紧离李行亮远点吧,河北,0,24-11-19 11:43
3318,小李爱钓鱼-,想当爽剧女主是吧,江苏,0,24-11-19 11:35
3319,JR噢买尬,麦姐，健身、瑜伽，减肥，回到以前的身材，会更美更自信,广西,0,24-11-19 11:35
3320,只是一个悦啊,看了评论区终于爽了点了,云南,0,24-11-19 11:33
3321,爱吃青椒和香菜,真的是麦林吗,江苏,0,24-11-19 11:29
3322,s花花一小朵s,要别人理解你，也要先有理解别人的能力才行，真的太窒息了。,天津,0,24-11-19 11:18
3323,_Arena,纯纯坏种 天生坏种,青海,1,24-11-19 11:12
3324,某F改名攒欧气,我一开始看以为你们是夫妻间感情有问题，看完节目发现是人品问题。你说你懂黄圣依母亲不愿意去请保姆的原因，但是人家母亲是高知分子不需要通过家务取得获得感。你说你会管家会收拾，也只看到了你行李箱收不好擦鼻涕纸乱丢衣服乱放用酒杯当烟灰缸。,安徽,3,24-11-19 11:01
3325,左耳听见597,心趴,浙江,0,24-11-19 10:46
3326,找点草吃,造孽啊,重庆,0,24-11-19 10:46
3327,用户7841342439,自己不赚钱让别人节俭，但是自己还挥霍。你哪来的脸啊，装什么装啊一天天的，反正你也装不明白真没见过你这种人,江苏,1,24-11-19 10:43
3329,源兰是你-,凭什么就你能指别人，李行亮就不能指别人？离婚节目你搞什么恋综,江苏,4,24-11-19 10:37
3330,Charmin宝,世界上怎么会有你这样的女人，哦，no，是你这样的人,上海,1,24-11-19 10:37
3331,小肉肉有大梦想,真是恬不知耻，一边说着只想亮子好，一方面又数落都是亮子不好.还把钱跟孩子都带走，这叫只想他好？我看你评论删的挺快,山西,3,24-11-19 10:29
3332,zkh太阳,真的是第一次隔着屏幕这么讨厌一个人,河南,0,24-11-19 10:27
3334,李小诺687,你真的人品有问题，半点教养都没有,广西,3,24-11-19 10:21
3335,陈然一直很傲娇_,你算什么东西呀 老大姐,河北,0,24-11-19 10:20
3336,喜欢看甜甜的CP,打了一堆文字又删了，只能说你真的是太吓人了,广东,0,24-11-19 10:09
3337,Gladys1217,赶快离了吧，放过李行亮,上海,0,24-11-19 10:00
3338,我清楚地看見妳_,。。,江西,0,24-11-19 09:50
3339,痛失姓名的怪兽,太邋遢了！咦～,福建,0,24-11-19 09:50
3340,凉水煎蛋,劝你多考虑一下自己的评论，我真是笑了。你本来就很自我了，你能不能学会换位思考多体谅一下别人,吉林,0,24-11-19 09:47
3341,叫我吃人就好了,出来挨打,江苏,1,24-11-19 09:42
3342,一只挠墙的猫,图片评论,江苏,2,24-11-19 09:41
3343,鹤梧卬,你知道吗？你知道吗？你知道吗？你知道吗？ 我不知道不想知道 0个人在意 OK？,江西,4,24-11-19 09:39
3344,三角猫__,你能不能清醒一点啊 正确审视一下自己呢 我真想恶毒的骂你 但是我觉得你不配,黑龙江,0,24-11-19 09:38
3345,觅_鹿,麦麦，留言只是想让你知道，我是支持你的，更希望你找到自我活出自我，加油！不要被骂声影响！,广西,1,24-11-19 09:25
3346,ZhyyAZxx,先不说你的婚姻孰对孰错，就熏鸡事件来看你的人品就有问题。,山东,1,24-11-19 09:19
3347,Coc0nutt,这种臂养子还有水军洗白吗？服了。。,福建,6,24-11-19 09:06
3348,野花别放肆,李行亮倒了八辈子霉娶到你！！！,河南,7,24-11-19 08:55
3349,糯米馅的冰糖葫芦,你贱不贱,山西,0,24-11-19 08:55
3350,翻版腾讯啊,离了吧求你了,陕西,0,24-11-19 08:50
3351,桃皮记录仪,你起来吗我被气的生理性胃痛,安徽,0,24-11-19 08:46
3353,小刘没烦恼4,你赶紧去看看心理医生吧,山东,0,24-11-19 08:28
3354,Ss_橙子_sS,姐妹，直接去找份工作吧，会解决一切,广东,0,24-11-19 08:19
3355,MARY52011,大开眼界，从来没见过你这么坏的女人,江苏,0,24-11-19 08:16
3356,阿屿吃不饱,你真的纯坏 人同学借你们住房子不知道感恩 借你们500块钱还嫌少去跟别人吵架 怎么做到这么理直气壮的,云南,7,24-11-19 08:07
3357,shiyiwujiaa,还好我的背包夹层不是你,云南,0,24-11-19 08:04
3358,YwZhn,待节目真气人 你是真火了 现在多的是人关心你 你到是满意了,湖南,1,24-11-19 07:58
3359,YwZhn,真服了你了，实在不行找个班上吧,湖南,1,24-11-19 07:57
3360,达蒙酱酱酱,我可终于找到你的微博了,辽宁,1,24-11-19 07:56
3361,我有一个饱满的高颅顶,找点事情干吧 就是太闲了 放过李行亮吧,浙江,1,24-11-19 07:54
3362,袔祎,去看心理医生吧,浙江,2,24-11-19 07:46
3363,是茼蒿,为什么有的人没有美貌、善良、素质、气量、耐心，还能有人爱,湖北,1,24-11-19 07:28
3364,shuixinyou,我反正不会和你做朋友，你两口子离我们远远的。,四川,2,24-11-19 06:52
3365,楠楠爱吃三文鱼_,请问今天他俩离婚了没,安徽,2,24-11-19 06:50
3366,qaq小菜菜,大家其实没必要说，她就是单纯的没脑子智障而已，无所谓的，远离就好了,天津,0,24-11-19 06:45
3367,历史狂人v587,麦总,辽宁,0,24-11-19 06:33
3368,everydayisJune3rd,卧槽大妈你给我气疯了我真不中了,德国,0,24-11-19 06:17
3369,想杀马特想得头都要秃了,没有人投诉造谣的人吗 投诉啊 把他们全部投诉进去,安徽,0,24-11-19 05:53
3370,久一心宝宝,真的看你太气人了，都不想浪费口舌说你，只是想让你知道知道，你快自己主动离婚放过你老公吧。,辽宁,3,24-11-19 05:36
3371,胡龙倩倩,撒泡尿照照自己,湖南,1,24-11-19 05:34
3372,想杀马特想得头都要秃了,建议起诉网暴者 加油麦麦,安徽,0,24-11-19 05:29
3373,戰前李钟硕,你是第一个让我下载微博想来骂你的 估计也是最后一个 活着就是祸害人,河南,1,24-11-19 04:46
3374,请你喝PEPSI_,你是真的太炸裂了…无敌炸裂…孩子跟你怎么活啊？,上海,1,24-11-19 04:20
3375,-阿格里-,再投次胎吧,湖北,3,24-11-19 03:42
3376,婉玲104,你到底要多少张毛毯啊？？？,广东,8,24-11-19 03:35
3377,流沙不爱酱,你和张婉婷可以cp一个随时随地大小哭，一个随时随地发疯！,湖南,2,24-11-19 03:26
3378,小煌soooft,你哭个掉,广东,0,24-11-19 03:22
3379,Vincy硕,你还是好好待在家里吧，别出来参加节目气人,广东,1,24-11-19 03:16
3380,阿茶小进化,让身边的人声音小点，好好整理一下自己的思绪，你很棒。,山西,1,24-11-19 03:03
3381,道芜-,两三千的人都看不上你好吧,湖北,0,24-11-19 03:02
3382,道芜-,那么喜欢管别人 天底下你最对呗？咋不给你自己那嘴跟形象管管 本末倒置,湖北,2,24-11-19 02:54
3383,小丑541,一天哭800回，就只看到自己的委屈，看不到别人的委屈,广东,4,24-11-19 02:40
3384,枕月亮的猫,总是说自己配不配拥有一杯咖啡。干嘛？你在乞讨吗？你总说别人不给你脸面，其实你自己总把自己搞得没脸面。你到底懂不懂尊重自己尊重他人啊？,广东,1,24-11-19 02:35
3385,晚霞余满天,离婚吧姐，你太折磨人了，作精一个，连我一个女人都非常讨厌你，长的不好看就算了，还那么强势，你根本不配当一个妻子和母亲，你的孩子为有你这种母亲感到耻辱，离婚吧求求你，对李行亮来说是一种解脱，你去找你的白马王子去吧,湖南,0,24-11-19 02:33
3386,YNManic,你也就能整个他，他是老实又简单。换个人你试试，你老公那个圈子，换谁都不可能跟你这么多年。,美国,1,24-11-19 02:32
3387,微风吹来老故事n,大半夜的刷到你们综艺的视频 气到睡不着 你猜为什么气到睡不着,广西,0,24-11-19 02:11
3388,踩完就跑,唉有些人骂得太难听了，麦麦或许有错，但外貌羞辱人身攻击就太过了,安徽,1,24-11-19 01:54
3389,Diercc,乳腺堵了,重庆,0,24-11-19 01:51
3390,用户6508617405,离婚吧姐，你太折磨人了，作精一个，连我一个女人都非常讨厌你，长的不好看就算了，还那么强势，你根本不配当一个妻子和母亲，你的孩子为有你这种母亲感到耻辱，离婚吧求求你，对李行亮来说是一种解脱，你去找你的白马王子去吧,江苏,6,24-11-19 01:27
3391,张小佳家,你这种人真可怕,浙江,2,24-11-19 01:17
3392,狐仙姐姐Xue,作为女人，真的忍不住要骂你 你好自以为是啊作的有点让人难以接受，擦亮眼睛吧这么多人为什么会骂你 肯定是你真的有问题,陕西,0,24-11-19 01:16
3393,小董的晚睡秘诀,你需要改变了,湖北,0,24-11-19 01:04
3394,橙子橙子柠檬味,麦麦加油爱你,广东,0,24-11-19 00:53
3395,喜茶的希,加油麦麦，支持你离婚，一个人自由点，环游世界去吧，不用在乎任何人的爱，亮亮他值得更好的爱。,山东,1,24-11-19 00:39
3396,贝螺湾,看完你说的话，气的我一晚上没睡着，天下之大无奇不有,江苏,1,24-11-19 00:27
3397,我要抓走你的维什戴尔,我c似你的🐎,山东,0,24-11-19 00:24
3398,Jhduan,我c你密码,北京,14,24-11-19 00:15
3399,李不言3,s13,陕西,2,24-11-19 00:14
3400,WikCcccccc,没看那档综艺 可是刷🍠都在骂她 我也不知道为什么 好奇心就去看了个别片段 我的天 看不到一分钟 看不下去了 太窒息了,广西,0,24-11-19 00:13
3401,Hoho_爱西瓜,去豆瓣看看吧，之前评论会多一点点思考。加油，这个程度的网暴不应该如此。,四川,0,24-11-19 00:12
3402,星河7660156571,哈喽,陕西,0,24-11-19 00:05
3403,破烂黄桃子,很难想象有人拿不出手到这个程度,湖南,0,24-11-18 23:50
3404,嘟嘟左ance,能不能离婚啊,陕西,0,24-11-18 23:43
3405,上弦月up,既然对容貌在意，就做好身材管理，家里有父母有保姆，练练瑜伽跑跑步，干点啥学点啥提升自己不好吗？,河南,0,24-11-18 23:42
3406,一只大屁蚊,看你节目看的生理不适了哈,广西,0,24-11-18 23:40
3407,Byshiv,要颜值没颜值 要素质没素质 要人品没人品 要善良没善良,内蒙古,0,24-11-18 23:34
3408,用户7450145054,您是不是对自己没有正确的认知？你想找有钱又依附你听你的，天天安慰你脆弱情绪，建议你先成为富婆 包养个男人，对你言听计从。你一不上班，没社会能力，二来你长的那样，不能靠脸吃饭，三又强势，所以你就别天天找事，你还瞧不上李行亮，太可笑了。请问如果没有李行亮，现在谁又知道你是谁？,天津,1,24-11-18 23:32
3409,游荡者吴笛,麦麦，希望你好,广东,0,24-11-18 23:28
3410,belief116,你告诉我，你是精神真有问题还是节目组给你的人设就是这样,浙江,0,24-11-18 23:19
3411,Heli61246,xs，这段婚姻里谁受益谁倒霉不是一清二楚吗？ 李行亮想买的大G，摩托，别墅，音乐设备，几万块的的大衣一个都没少；而麦琳从很能给自己花钱的爱漂亮小姑娘变得一件衣服都不敢给自己买。 你们还真信麦琳拥有这些钱啊？ 她不过是个免费的出纳罢了。 以前她赚钱养李行亮， 生孩子骨裂，,美国,6,24-11-18 23:07
3412,静待蝴蝶少年,来了,安徽,1,24-11-18 22:59
3413,雪落无声0613,那句除了你老婆，谁你都可以得罪，绝了,江西,0,24-11-18 22:50
3414,看星星去巴扎嘿,什么玩意儿啊,北京,0,24-11-18 22:48
3415,阿丽_H,你看见这么多黑评会哭的吧，哭精，以自我为中心，多大本事啊,河北,0,24-11-18 22:45
3416,大米会游泳,放过李行亮吧，你说人家不哄你，人家跑来和你聊，希望你能懂，结果你根本不听，哭就有理了？你不也没指李行亮吗？你单纯是情绪，李行亮是真的为了解决问题而来的，和你在一起好可怕！赶紧放开李行亮吧，找你的富豪去！！！,广东,9,24-11-18 22:42
3417,小明很文明,快去跟之前追你的富豪在一起吧 作精幻想家,浙江,0,24-11-18 22:41
3418,大米会游泳,你真的很吓人！赶紧去看心理医生吧,广东,0,24-11-18 22:39
3419,空城記-,@Abracadabra323,云南,0,24-11-18 22:37
3420,Augus-姗,一个女人，怎么可以同时没有智商 情商 美貌 家教和人品！,广东,2,24-11-18 22:36
3421,魏梓纯别浑噩下半生,麦琳就是标准的NDP人格！,广东,0,24-11-18 22:33
3422,无计消除-,你是真,吉林,0,24-11-18 22:31
3423,SC沈驰,。,辽宁,0,24-11-18 22:28
3424,杨冰月018,你刷新了我✅素质低人品差的认知,日本,0,24-11-18 22:26
3425,9DORIS,作为女人你真的很作！ 行亮曾经是出轨了吗 你要一直这样折磨别人。能过就过 不能过赶紧去找有钱人。,浙江,0,24-11-18 22:20
3426,葛沽宋小宝,不欣赏他的音乐。却喜欢他音乐赚来的钱[捂脸],天津,0,24-11-18 22:18
3427,藤赫-,这个人自私虚伪贪婪不知足，报复心强没教养，真的占全了，你真的好不要脸,浙江,0,24-11-18 22:12
3428,wuli哥斯拉,这是真麦林吗？,山东,0,24-11-18 22:01
3429,北纬3231400620,离婚吧姐妹，放过你老公,江苏,0,24-11-18 21:59
3430,这辈子要干的事,唉看了评论区的不友好难过啊还特意来别人评论区发泄,浙江,2,24-11-18 21:56
3431,Junk欣,哪位富豪来认领一下，到底谁追过年轻的麦麦让我们开开眼,河南,5,24-11-18 21:55
3432,He俊博,求离婚,山西,0,24-11-18 21:53
3433,熟男07,我要吃熏鸡，我要吃两个,天津,0,24-11-18 21:37
3434,沧海焉知你成梦,离吧赶紧的,江西,1,24-11-18 21:32
3435,王逗逗按,装货你可别祸害李行亮了他都要碎了,新疆,2,24-11-18 21:30
3436,红_豆刨冰,你还是在桥洞里一边抽烟一边吃熏鸡吧,上海,0,24-11-18 21:24
3437,欣小娸,你要买爱马仕找我,上海,0,24-11-18 21:19
3439,你脑容量小别说话,钱让你花完了，你说别人不会理财，给你能的，哭哭哭就知道哭,新疆,0,24-11-18 21:10
3440,你脑容量小别说话,你自己咋不去表演才艺,新疆,0,24-11-18 21:10
3441,Wpsheng,依托答辩,广东,0,24-11-18 21:04
3442,学在库区,你家家教有问题,天津,0,24-11-18 20:59
3443,十七___17,这么喜欢熏鸡是因为你们是同一个品种吧,福建,4,24-11-18 20:57
3444,阿越啊--,没见过这种人 报复心这么强 人家用早饭选择换的抽烟 你也抽了人家的烟 还一直说说说 笑的像个sb一样 这么大的嘴 真服了 做人没有人品 没有道德 没有边界感 le se！,天津,0,24-11-18 20:50
3445,WKangN1,你看起来好脏,广东,0,24-11-18 20:49
