comment_id,user_name,text_raw,source,like_counts,created_at
890,J1vvv,看到大家的评论我就放心了,上海,1,24-5小时前
891,阿文今天下凡了嘛,你能不能直接离婚，你跑这节目上来干嘛？你自己觉得人家不爱你，那你直接离婚啊，能不能别再出现在屏幕上啦，你真的很牛哎，成功让全国人民都讨厌你，别给女人丢脸了，身边的人一提到你就没有一个帮你说话的，大姐，反思一下自己的问题好吗，一切都是你自己的选择，你后悔受不了你走啊,辽宁,0,24-5小时前
892,再见我美丽的青春有理想001,特意下载的微博，三四十岁的人了，还停留在我好不好看，老公关不关心我，真的太肤浅了，一边好吃懒做，一边又焦虑，所有的焦虑都是自己能力支撑不了你的理想。还把所有的事情怪到李行亮身上来，霸凌他，欺负他，窝里横！！！我真是开了眼界了，怎么会有这样愚昧无知可恨的人！！！！！,湖北,0,24-5小时前
893,栗子爱吃糖啊,[生气R][生气R][生气R][生气R][生气R][生气R][生气R][生气R][生气R][生气R][生气R][生气R][生气R][生气R][生气R][生气R][生气R][生气R][生气R][生气R][生气R][生气R][生气R][生气R][生气R][生气R][生气R][生气R][生气R][生气R][生气R][生气R][生气R][生气R][生气R][生气R][生气R][生气R][生气R][,上海,0,24-5小时前
894,-WZhaoHui,真疯批,贵州,0,24-5小时前
895,丢三落四的兔猪琼,快去读读书吧。没文化太可怜了,法国,0,24-5小时前
896,小蓝太阳,你有在乎你老公的感受吗 那么多人让你的老公下不来台 不顾虑他的感受 你还好意思说你爱他 明明你们才是家人亲人 你在别人看你俩的笑话你知道吗 你们才应该抱团啊 30 多岁了 哪那么矫情啊 差不多得了 还要哄你 你看看人家葛夕格局多大了 留一手都那样了 李行亮又哪里对你不好了 一千个字都不够喷你,吉林,0,24-5小时前
897,薯片我的爱w,你好ex,湖北,0,24-5小时前
898,me不喜欢坏糖果,你想要李行亮的命吗？,安徽,0,24-5小时前
899,Rcain_,你的良心到底在哪里,广东,0,24-5小时前
900,侯杏儿xx,你可赶紧放过亮子吧 你太可怕了 让五个人都给你提供情绪价值 你还觉得别人自我 自私 你可真有意思 我们都在嘲笑你的愚蠢 只有你在把自己的蠢当做光荣炫耀,湖南,0,24-5小时前
901,聊城第一胖,你真是个大杀币,山东,0,24-5小时前
902,漂亮哥哥_1999,无语🙄,贵州,0,24-5小时前
903,小阿炮54188,老子忍不了，我燥泥马，这辈子没见过你这么剑的人，上剑不练练下键，我就＊＊＊＊＊＊＊＊＊＊＊＊＊＊＊＊＊＊＊＊＊＊＊＊＊＊＊＊＊＊＊＊＊＊＊＊＊＊＊＊＊＊＊＊＊＊＊＊＊＊＊＊＊＊＊＊＊＊＊＊＊＊＊＊＊＊＊＊,上海,0,24-5小时前
904,-翠嘴公主-,你的每一个表情，动作，语言，甚至笑，我都要停下来一字一句反复斟酌，我生怕漏过你藏起来的爱和善良，很可惜我越是仔细窥探解读，越是憎恶，你认知低，逻辑混乱，强行拨高，把爱作为攻击的利器达到你的目的，你愚蠢，语言幼稚，思想混沌，认知低下，智商情商双低，其次你很弱，欺软怕硬,辽宁,3,24-5小时前
905,看世界吧111,我很少心疼男人的，不知道李行亮这么多年这么苦,陕西,0,24-5小时前
906,铜锣烧真难吃,说实话真的不喜欢你，我先不评价你的外貌省得说我肤浅，你这种女的整天编什么以前有钱人追你，你可以过体面生活什么的挂在嘴边然后疯狂的去pua李行亮。我说句不好听的如果换我，早就跟你离婚了。你其实就是一个三无人员，无工作，无社会经验，无样貌。亮哥能够在出名后还能忍受你，这已经是你的福分了,重庆,1,24-5小时前
907,铜锣烧真难吃,垃圾东西，你配吗,重庆,0,24-5小时前
908,小温要幸福,看视频我都感觉要窒息了，跟你相处太恐怖了。你真是太太太太太讨厌了。,河南,0,24-5小时前
909,水土不服张先生,说实话现实中遇到你 可以轻轻的给你一锤吗 熏鸡姐,北京,0,24-5小时前
910,用户i7wmj7gb1t,……,福建,0,24-5小时前
911,莉汁味,你还是放过李行亮吧,湖北,0,24-5小时前
912,我的裤子它老掉,怎么会有这么上不了台面的人,广东,0,24-5小时前
913,Untitled519,我就艸氼孖了÷升东西,江苏,0,24-5小时前
914,仙境之上_wonderland,觉得委屈要不然就把这些年你俩对家庭的付出全拿到台面上来，让观众评评理呗,江苏,0,24-5小时前
915,背着壳的兔子AL,你…绝,陕西,0,24-5小时前
916,侵llllll华大学,正宗大肥,广东,0,24-5小时前
917,仙境之上_wonderland,你就是通过控制李行亮让他服从，来满足自己的需求，你愿意服从是出于对你的爱，但不代表他是白痴，从这点上说我感觉到的一直是他更爱你，而你是把他当成满足自己的工具，更自私的人一直都是你，现在离开了李行亮你啥也不是，你就是因为太无能了，所以才这样道德绑架你身边的人，包括以后的孩子。,江苏,0,24-5小时前
918,安之若素AWZ,脑子有泡一样 自己是个恶心没下限的人 还在那边pua别人 打就都是正常人 安慰你 只是不想和疯子计较 一天天的 闲出屁了 你才有心思想这想那 减减肥吧,瑞士,0,24-5小时前
919,用户6808318181,麦琳，回到现实吧，没人安慰你，节目里大家只是顾全大局，息事宁人的方式，劝劝你罢了，你还当真以为是人家安慰你，学历低不能连起码的眼力见都没有吧，你可做个人吧,北京,0,24-5小时前
920,是店长大人,大妈你真能找一个月两三千的工作?没颜值没学历没教养没脑子，当观众傻子呢,贵州,0,24-5小时前
921,用户7673526802,哎，看一个片段就想进来骂几句，快离吧，真的，你就适合自己过！,山东,0,24-5小时前
922,究极风暴战士,吸血鬼,河南,0,24-5小时前
923,_Miaoyuan,是她吗,吉林,0,24-5小时前
924,弥海砂5349,赶紧找个心理医生去看看 接受专业治疗 本来我也是更心疼女方的 ，但是你真的是跌破了底线 太可怕了你,广东,0,24-5小时前
925,幼稚园腼腆小美,打脸不，拉着黄圣依本来想炫耀一下，结果人家说一大早就收到了礼物，你第一反应是贵，你眼里只有用金钱来衡量价值呗,四川,0,24-5小时前
926,不喜欢别乱来,真的臭S,法国,0,24-5小时前
927,弥海砂5349,看了你的综艺真的受不了 。把大家的体面当成你不要脸的工具。,广东,1,24-5小时前
928,暗涌的红豆,熏鸡 奶皮子都让你买 得了便宜还卖乖 嘲讽人家钱花完了该怎么办 你人品有点问题,辽宁,0,24-5小时前
929,请让我做一只锦鲤女孩,不是李行亮的粉，但是作为一个女生真的都完全不能共情你，真的感觉很讨厌在一群人一日游玩的时候，因为你影响大家的心情，大家都来哄你，真的一点体面都没有。看了直摇头,四川,2,24-5小时前
930,我就是想瘦成猴子,图片评论,宁夏,0,24-5小时前
932,是你龙哥呀2018,现在全世界最烦的人就是你了,辽宁,2,24-5小时前
933,不重要同志,轰，哦,浙江,0,24-5小时前
934,_yayazuzuyeahhhhhhhhh,纯见人,安徽,2,24-5小时前
935,木偶飛,自私冷血,北京,0,24-5小时前
936,H芋葵酱,你是不是喜欢扬子啊？,福建,2,24-5小时前
937,Ai亚亚亚,不允许你单方面网络霸凌我，未知全貌，不予置评。你能把全貌发出来吗，我也不是非要骂你，你也可以告诉我你是个好人，让我消气就行。,山东,3,24-5小时前
938,二忧真的很困,大姐，你适可而止吧,贵州,2,24-5小时前
939,我不是小睡包,你的人设怎么都崩塌了呀？为了上节目设置人设怎么不保护好点呢啊？怎么全都崩塌了？,河南,0,24-5小时前
940,你看这坨云,李行亮是怎么忍你十年的我的天呐太恐怖了,河南,20,24-5小时前
941,我不是小睡包,我的老天爷呀，同为女人，我都感觉你，太可怕了，你真的太强势了，不讲道理的那种，为什么每次都把话题围绕着你呢啊？为什么不好好反思？为什么呢？明知道有这些错，为什么就不会改一改呢？天天pua李行亮，我的老天爷我都看不下去了,河南,1,24-5小时前
942,宫保鸡丁_yyy,你跟我曾经一个垃圾朋友极像，所以她没有朋友，包括唯一一个我都远离了,广东,0,24-5小时前
943,你看这坨云,你真的把我气的头蒙,河南,0,24-5小时前
944,二十六载的_梦,求求你了姐，放过李行亮吧,江西,4,24-5小时前
945,KIDA_WANG,看着大家都在骂，我就放心了,重庆,37,24-5小时前
946,用户7925062360,你是真傻比啊,浙江,0,24-5小时前
947,软软的小红梅,评论删的挺快呀,四川,0,24-5小时前
948,谭竹炎炎夏日,一个优点都没有.不漂亮 身材不好 情商没有 智商没有 口才也没有 人缘也没有 心肠还有点坏.还要求男方为你干着干那得.你有什么资格吗？哪里值得吗？就是仗着你老公宠你爱你.真是不经过大脑为所欲为.男方离开你才是有致的飞跃.你离开男方就像是巨婴离开了爹😏说不定你还会把男方掏空.,江苏,3,24-5小时前
949,一粒莲,农村大专打工妹还幻想着做大富大贵富太太 偶像剧看多了关键偶像剧里女主都很优秀呀你怎么一直在索取亮亮 没有对你自己要求高一点呢你的首要任务是中专升大专 然后大专升本科 你学历的低下已经影响你智力和逻辑了 在大学生满大街的时代 你竟然只是个中专特别恐怖😱,辽宁,2,24-5小时前
950,永远信仰神明,希望你孩子以后都能遇到你这样的女人,浙江,0,24-5小时前
951,嗯哼啊哈啧啧啧,没事儿就是单纯的想来骂你,四川,0,24-5小时前
952,悦泽澄说,你去找个自己的工作吧，不要事事掌控李行亮了，看得出来他很在乎你和你们的家，不要老想着让他用某种行动去证明他爱你，你先爱自己，家务你想干就干，不想干就休息，把自己照顾好，事业上的事让他自己做主，他主动向你寻求意见时你再帮他出谋划策也是可以的啊，为什么要像个老妈子一样事事要控制呢？,湖南,1,24-5小时前
953,甘露寺的菩萨,别装了大妈，做了就做了，要敢作敢当。要当表子就别里牌坊，表子就应该去立碑立什么牌坊啊,日本,1,24-5小时前
954,远远冲锋队-陈远远圆圆,太作了,广东,0,24-5小时前
955,TaraNash,大脑发育不完全 小脑完全不发育,吉林,1,24-5小时前
956,TaraNash,你真他妈是个极品,吉林,2,24-5小时前
957,子辰累了,🌿,江苏,0,24-6小时前
958,ceremony_,姐 你有大饼吧姐 好可怕啊,福建,0,24-6小时前
959,入睡困难户吧,从未见过你这样离谱之人,广东,0,24-6小时前
960,Fairy1ove,大脑发育不完全 小闹完全不发育,四川,1,24-6小时前
961,厦门租房小蜗牛,以前你让我气的每天半夜都要骂你一遍，现在我已经不想骂你了，人品这么差的人，连被骂都不值得！,福建,0,24-6小时前
962,lyaw33974,给我气蒙了,辽宁,0,24-6小时前
963,一粒莲,农村大专打工妹还幻想着做大富大贵富太太 偶像剧看多了关键偶像剧里女主都很优秀呀你怎么一直在索取亮亮 没有对你自己要求高一点呢你的首要任务是中专升大专 然后大专升本科 你学历的低下已经影响你智力和逻辑了 在大学生满大街的时代 你竟然只是个中专特别恐怖😱,辽宁,2,24-6小时前
964,杨冰月018,你真的，你得给观众们精神损失费,日本,1,24-6小时前
965,唐子heng,你爱牵不牵,美国,0,24-6小时前
966,唐子heng,woc你吗,美国,1,24-6小时前
967,Dear-zn娜,一个女的都看不下去了，作精啊你是，你放过亮子吧，你比那诈骗大师都能pua啊,黑龙江,0,24-6小时前
968,疾风东指,麦琳真是撒谎成性，自私自利啊，这不是婚姻的问题了，也不是李行亮的问题，这是麦琳自身的素质和个人品行就存在很大问题啊,江苏,3,24-6小时前
969,柯澜111,不要再情绪霸凌所有人了…你现在最重要的事是读点书,英国,1,24-6小时前
970,Echo桃儿,看着真有点烦人，葛夕那么好，你为什么要那样呢？而且大家出去玩，就你和李行亮闹别扭，影响大家，真的好烦啊，还要来安慰你，无语了🙃你们两夫妻的事就不想评价了，但是不要影响别人，可以吗？不是全世界都围着你转！你凭什么！,重庆,0,24-6小时前
971,打败娱乐圈所有的虚伪,真的吗,江苏,4,24-6小时前
972,二丫的太阳花,天哪，光看片段我已经气的不行了 真的没有办法想象和这样的人生活在一起该是多么难受,河南,0,24-6小时前
973,在船舱写博客的海狮,💩💩💩💩💩💩💩💩💩💩💩💩💩💩💩💩💩💩💩💩💩💩💩💩💩💩💩,广东,1,24-6小时前
974,在船舱写博客的海狮,💩💩💩💩💩💩💩💩💩💩💩💩💩💩💩💩💩💩,广东,0,24-6小时前
975,在船舱写博客的海狮,💩💩💩💩💩💩💩💩💩💩💩💩💩💩💩💩💩💩💩💩💩💩💩💩💩💩💩💩💩💩💩💩💩💩💩💩💩💩💩💩💩💩💩💩💩💩💩💩💩💩💩💩💩💩💩💩💩💩💩💩💩💩💩,广东,0,24-6小时前
976,在船舱写博客的海狮,💩💩💩💩💩💩💩💩💩💩💩💩💩💩💩💩💩💩💩💩💩💩💩💩💩💩💩💩💩💩💩💩💩💩💩💩,广东,0,24-6小时前
977,在船舱写博客的海狮,💩💩💩💩💩💩💩💩💩💩💩💩💩💩💩💩💩💩💩💩💩💩💩💩💩💩💩,广东,0,24-6小时前
978,根本睡不醒bb,人不能既要又要 而且在节目中拉着别人孤立自己的老公 不尊重自己老公 夫妻本是一体的 一荣俱荣，一损俱损 搞不懂一天天的作什么 哭哭哭哭还有非常魔性的笑 你为什么从不正视自己的问题 发现问题并且解决问题不好么 一直在那作,江苏,0,24-6小时前
979,徐momo呀,你真的是个奇葩,浙江,0,24-6小时前
980,在船舱写博客的海狮,💩💩💩💩💩💩💩💩💩💩💩💩💩💩💩💩💩💩,广东,0,24-6小时前
981,鬼·TAT,越看越生气。你带头孤立李行亮。就因为他没父母你这么欺负他？你是人吗？,广东,0,24-6小时前
982,不太胖的胖子2018,为什么总是要pua，而且当着全国的人的面，哪怕当着6个人的面，也要注意卫生，要把自己最好的一面展示一下呀，你到底咋想的,天津,0,24-6小时前
983,欣欣gao29,换一个人嚯嚯吧,吉林,1,24-6小时前
984,PeferPan,你很有毒耶！！多反思一下自己吧,广东,0,24-6小时前
985,劲爆海螺,牛魔的你就是个初升你知道吗？,广东,0,24-6小时前
986,CLDES,你真的太有问题了 别pua 别人了,加拿大,0,24-6小时前
987,CLDES,你真的是个毒瘤,加拿大,1,24-6小时前
988,薄冰随行,你和李的事情你们自己解决，尽管觉得你无法理解稍微高一点的层次思维，李在向下兼容你，他说的那么真诚你听不懂，反而喜欢戏耍你感情的方式，但你俩来解决问题，其他人也是要解决问题的，没这个节目，其他人和你没交集，你不觉得你总在打扰其他夫妻解决他们的问题吗，都得围着你转吗,北京,2,24-6小时前
989,水宝儿-0707,赶紧把婚离了吧 别祸害人家了,江苏,1,24-6小时前
990,长时间没回复联系QQ972295831,了,福建,0,24-6小时前
991,凡人2389763933,呵呵呵鹅鹅鹅哈哈哈×N你知道嘛×N，我是宇宙银河星系天皇至尊无上天帝太奶,浙江,0,24-6小时前
992,画地为囚75509,什么样的家庭能培养出你这种极品的女人想象不出,湖南,2,24-6小时前
993,周周有钱花0,牛掰,广西,0,24-6小时前
994,-_-小白Veromca,不行了，太可怕了！简直不可理喻！你还是人吗,广东,1,24-6小时前
996,千里予臣,删吧删吧，删了你爆炸,江苏,1,24-6小时前
997,千里予臣,图片评论,江苏,1,24-6小时前
998,不想努力了只想躺平_,你是何等的sb ？就…还好，好你大耶啊,广东,0,24-6小时前
999,框框Yoli,你就是个🐷，看到你就想吐,陕西,1,24-6小时前
1000,细腻蝴蝶做甜点,，听见你说话就窒息！再见爱人的嘉宾都哄你，我们正常人可看不惯你，你被网暴了！作精！！,内蒙古,1,24-6小时前
1001,饭饭爱吃肉哇,你要不要看看你自己长什么样？,山东,0,24-6小时前
1002,鑫鑫超级哇塞,终于找到你了，只能说你很幸福，但是不珍惜。,安徽,0,24-6小时前
1003,你为什么是呆瓜,你是疯了吗,北京,0,24-6小时前
1004,飞鸟只爱肥肥鱼,我真的要弃看了，你到底想要什吗,广东,0,24-6小时前
1005,用户6247023967,您能不能看看评论啊？ 别人安慰你无非是场面话 给你个体面 你还真把自己当回事 因为您是女的 所以都会让着你点 但并不代表您是对的 您这样的离开了节目她们还会来安慰您吗 只想远离您这种人,浙江,0,24-6小时前
1006,翔静欣悦,……,四川,0,24-6小时前
1007,-1imzm,麦琳你就是tm的一刹比,湖南,1,24-6小时前
1008,大托马不大,想打你一巴掌,英国,0,24-6小时前
1009,emmmmmss,年轻的时候也不好看,英国,0,24-6小时前
1010,晨辉与月牙儿,哈哈哈，想到这个疯子看到评论疯狂删，爽,北京,23,24-6小时前
1011,srr微加幸福,我一期一期考过来的。你真的挺气人，挺坏的。你看到朋友老公送礼物，可以羡慕，你有自己的需求。李行亮也是人，他也有自己的需求，他表达羡慕留几手的时候，你说自己被撕碎了，为什么你可以有需求，别人不能有呢？为什么别人真正敞开内心跟你表达需求你就不想做出改变呢？为什么不反思自己的问题呢？,辽宁,1,24-6小时前
1012,天天289156,脑子不好，就去看医生，要不就离婚，别祸害别人,江苏,0,24-7小时前
1013,晨辉与月牙儿,请麦去看心理医生，马上离开家庭，你已经破坏力太强了，疯子疯子疯子，重复三遍，你已经疯了，自私鬼，吸血，你算是个什么玩意儿,北京,0,24-7小时前
1014,她叫王小队er-,你真逗阿你 咋这么逆天,重庆,0,24-7小时前
1015,Tennille-yeah,哎，李行亮养了你大一家子啊。你是怎么能的？上个班，你也不敢这么搞老板吧？,北京,3,24-7小时前
1016,天才芯,其实我特别理解麦琳，李行亮确实亏欠她许多，在一起这么久，李行亮连个耳光都舍不得给她，太寒心了,河北,1,24-7小时前
1017,兔兔酱R,要怎么样才能骂醒你？看看心理医生吧,美国,1,24-7小时前
1018,馒粤莓小饼干,你叫这名字简直侮辱这俩字,北京,1,24-7小时前
1019,依然晴qq,他怎么还会有4.7万粉丝啊,浙江,1,24-7小时前
1020,CR400BFC,正中大飞柱,山东,1,24-7小时前
1021,媚儿live,真的对你无语，放过李行亮，你们离婚吧,福建,1,24-7小时前
1022,Itsyuma,你俩怎么还没离婚,加拿大,1,24-7小时前
1023,ccioc17,赶紧离婚,山东,1,24-7小时前
1024,香煎猪排咖喱滑蛋,我本来不想骂你 因为觉得没必要隔着网线和一个陌生人输出 但我现在觉得 你真的太烂了 你是一个“社会化”极差的人 你们两口子的事情也就算了 录综艺的时候 你真的毫无职业道德吗 完全不遵守基本流程的 做人也一点边界感都没有 你真的是霸凌所有人 不停的骚扰其他两队嘉宾 让这个节目的设计全毁了,日本,3,24-7小时前
1025,铁柱儿姑娘,麦麦，别理会别人怎么说，你做得很好了。,辽宁,2,24-7小时前
1026,真的很皮备,完蛋玩意儿…小红薯删评能删一夜hhhh,河南,3,24-7小时前
1027,铁柱儿姑娘,麦麦，再见爱人我在追更，一开始我也觉得你不可以理喻，但是越看到后面，我越能理解你。你没有被看见，你有委屈，很多的委屈，却又说不清楚。深陷在一个圈里，却出不来。 麦麦，找个健身教练，先减肥，你以前很漂亮，现在依然美，只是有点胖了而已，我期待看到美美的麦麦。,辽宁,1,24-7小时前
1028,生气的妮妮妈,我从来没有试过劝人离婚，你还是离婚吧，太可怕了,广东,1,24-7小时前
1029,long王某某,我都想抽上你几巴掌,江苏,1,24-7小时前
1030,小卢的春夏秋冬,长这么的大 第一次希望有一个人 大家都能够来网暴她,新疆,1,24-7小时前
1031,明媚-四月天,李行亮不离婚天理不容！,北京,0,24-7小时前
1032,小小于yl,姐生气了建议直接说出来为什么生气，不要让别人猜，都是成年人了，直接表达会更好,河北,0,24-7小时前
1033,努力挣钱版小王,从来没见过有集缺点于一身的人,尼日利亚,4,24-8小时前
1034,徐小锤hammer,666,浙江,1,24-8小时前
1035,当地小有名的帅哥,太自私了,山东,8,24-8小时前
1036,爱情真的好伤8_654,天怎么会有你这种人,上海,1,24-8小时前
1037,我嗨你老豆呀,我tm真想一拳打飞你,海南,39,24-8小时前
1038,杰尼龟的秘密宝藏,能不能让我打你一顿，我愿意赔钱,河南,2,24-8小时前
1039,龙年大吉大利发大财,你这个人真是的好讨厌问题全是你的,山东,0,24-8小时前
1040,Miss_1114,币,辽宁,1,24-8小时前
1041,Miss_1114,沙,辽宁,1,24-8小时前
1042,Miss_1114,大,辽宁,1,24-8小时前
1043,灰灰是一片虾片,你太可怕了 太可怕了,美国,0,24-8小时前
1044,半月_云之君兮,哪的家庭教育搞出的脑c,黑龙江,1,24-8小时前
1045,Bluelobster327,说一套做一套哎，像个小孩一样不合心意就撒泼哭闹。李航亮不离婚应该会损失很多粉丝。,加拿大,1,24-8小时前
1046,胔而炜随_,受不了了，你应该没有朋友吧？你这种人能活到现在真的得谢谢所有人的不杀之恩,广西,1,24-8小时前
1047,在蜜蜂花园吃海鲜的天鹅,求求你放过李行亮吧 别再折磨他了 你这种人就适合单身 谁娶到你真的是倒了八辈子霉 都不知道这十几年来李行亮是怎么活的 需要看心里医生的是你啊真的心里太变态了 直接是扭曲的,重庆,1,24-8小时前
1048,阿星今天也想鼠,到底什么样的人才会支持你，我受不了了,广西,9,24-8小时前
1049,小卉籽籽,不讲道理不可理喻💩💩,江苏,6,24-8小时前
1050,Chloe_2261,🤮🤮,英国,1,24-8小时前
1051,QtWit,就拜托你稍微懂得一点点：这个世界上人人不同，但大多数俗人是正常的自私愚昧平庸同时自以为是，而你是最顶端的那部分，正态分布曲线的最尾端（不好意思，估计你不懂这个）,加拿大,0,24-9小时前
1052,鹿子Lulu籽,你赶紧离吧，放过亮哥什么时候真诚就那么不堪一击，四十多岁了大姐，你自己去挣钱找那种虚头巴脑的吧，自己的问题是一点也不承认啊，你是谁啊，怎么那么优越感呢，不爱就走，自己去找个两三千的工作，过上🚀般的生活，我🌿,广东,1,24-9小时前
1053,_羊肉泡馍,真想看看你爸妈，什么样的家庭能培养出你这么个极品啊？,陕西,1,24-9小时前
1054,臭屁小莲,别人安慰你 为什么安慰你因为你一天哭八百回 因为你让人觉得窒息 因为你爱偷换概念 因为大家都怕了你了 这点觉悟没有嘛 为什么好意思说李行亮？你是真傻还是假傻？,广东,2,24-9小时前
1055,我的记事本18542,这节目结束，希望你再也不要出镜,云南,0,24-9小时前
1056,用户7814405000,你这种人配给狗都会被嫌弃,福建,0,24-9小时前
1057,甜甜甜_YING,心眼坏 脏脏臭臭油油的,浙江,0,24-9小时前
1058,对方是什么队形,我就知道 这儿炸了,山东,0,24-9小时前
1059,我的记事本18542,第一次那么讨厌一个不相干的人,云南,2,24-9小时前
1060,桥楼冬季岛,恶毒,四川,0,24-9小时前
1061,黑黑闹不住,DSB,云南,1,24-9小时前
1062,0n-11na,心疼李行亮,意大利,6,24-10小时前
1063,璞LI,我草了，你太窒息了,浙江,8,24-10小时前
1064,呀呼苏打,麦麦你不要听评论区的鬼话,广东,1,24-10小时前
1065,初安姬音,麦琳太恐怖了，怎么会有这么恶毒的人。。。,英国,0,24-10小时前
1066,我可能不会养猫,麦琳 今天也想跟你说你很好 离开他你可以更好！你有这个能力！,广东,0,24-10小时前
1067,我的你的你的我的你,真想骂你,北京,1,24-10小时前
1068,吴梓贤201603,放过节目所有人吧，他们太累了，你真不是什么好东西，如果是演的那我佩服你真的演的我想诅咒你,福建,1,24-10小时前
1069,鱼香冰美肉丝,你他妈纯➗生,俄罗斯,2,24-10小时前
1070,我睡觉了拜拜l,我要是和你们同行的人我巴掌都扇你脸上,浙江,2,24-10小时前
1071,猫哥李小盼,这简直是个疯婆娘，一直打扰其它2对夫妻，烦人,四川,1,24-10小时前
1072,用户7951171663,劝你做个人吧,福建,2,24-10小时前
1073,MiaShS,请你赶紧离婚。,意大利,0,24-10小时前
1074,今天代码也没写完,麻烦你赶紧离婚坐火箭去，离这个地球越远越好,美国,0,24-10小时前
1075,Rmyranmi,疯婆子,上海,0,24-10小时前
1076,文迪Joke,看到你说话就想给你个大嘴巴,河北,2,24-10小时前
1077,橘子小姐的彩虹桥,yue,黑龙江,0,24-10小时前
