comment_id,user_name,text_raw,source,like_counts,created_at
1911,鱼崽崽05,李行亮也是极品 这种女的到底从哪找的？？？啊？？？？,河南,1,24-昨天 21:44
1913,Beauty思,你是怎么做到的。理解不了,英国,0,24-昨天 21:43
1914,至若景春和明,。,湖北,0,24-昨天 21:41
1915,汪静静,。。。,广东,0,24-昨天 21:39
1916,Thelastone61358,你快找个班上吧！,黑龙江,0,24-昨天 21:39
1917,卉卉guo,跟你在一起的人就很累,山西,0,24-昨天 21:39
1918,-壹呀么壹-,你看不到自己的问题,四川,0,24-昨天 21:39
1919,ALien-lily,说实话真的不喜欢你，我先不评价你的外貌省得说我肤浅，你这种女的整天编什么以前有钱人追你，你可以过体面生活什么的挂在嘴边然后疯狂的去pua李行亮。我说句不好听的如果换我，早就跟你离婚了。你其实就是一个三无人员，无工作，无社会经验，无样貌。亮哥能够在出名后还能忍受你，这已经是你的福分了,福建,1,24-昨天 21:39
1920,CC是狮子女王,快离吧 太压抑了,江苏,0,24-昨天 21:38
1921,用户wczsfpyxxscwsry,不是说离婚你的生活会质的飞跃？不是说很多富豪追你？不是说每个月两三千足够？那还不赶紧离婚 麻溜的快去好吗 没人拦你奔赴更好的生活,浙江,1,24-昨天 21:38
1922,砂糖肉丝,密码撕了,四川,0,24-昨天 21:38
1923,ALien-lily,实在是不能共情你，你真的特别特别自私,福建,0,24-昨天 21:37
1924,我不是王斯奇,太生气了，气哭了 我不敢骂你 只敢自己生闷气,贵州,0,24-昨天 21:37
1925,小蝴蝶音十年老粉,你能赶紧离开李行亮吗，你值得更好的，你值得更能哄你的，离开他好吗,天津,0,24-昨天 21:36
1927,卡欧非比,"小姐姐你要开开心心的呀，不要因为网上的不良言语影响心态，你以前真的好漂亮的，好有阳光气息的，不要哭泣哦，所有的事情都会向好的方向去的。""不要悲伤不要难过，忧郁的日子里需要镇静""""面朝大海春暖花开""",江苏,0,24-昨天 21:35
1928,Tammy谭瘦瘦,你快离婚吧，真的，放李行亮一条生路,北京,0,24-昨天 21:35
1929,习仔仔kkkkkkk,我是真他妈的服了你，赶紧离吧，你什么错也没有，拼命在你身上找优点，你！ 没有 ！任何 ！一点 ！一点 ！一点！ 优点,浙江,1,24-昨天 21:35
1930,我是金刚心,说白了，全是李行亮惯的,辽宁,2,24-昨天 21:35
1931,孤单听雨的熊猫R,NB，应该很难有人再给你辩解了，芒果台得给你加钱,浙江,0,24-昨天 21:34
1932,RPGBoon,一天哭八百次,重庆,0,24-昨天 21:34
1933,大大萝卜鱼,李行亮父母在天上看到得多心疼啊麦琳你s后不怕遇到他们吗,广东,2,24-昨天 21:34
1934,梨荣浩,我说的话可能体现不出来************,河北,0,24-昨天 21:34
1935,用户6588816995,说实话真的不喜欢你，我先不评价你的外貌省得说我肤浅，你这种女的整天编什么以前有钱人追你，你可以过体面生活什么的挂在嘴边然后疯狂的去pua李行亮。我说句不好听的如果换我，早就跟你离婚了。你其实就是一个三无人员，无工作，无社会经验，无样貌。赶紧离婚吧。别耽误亮哥,河北,1,24-昨天 21:34
1936,冬暮慕槿,快点离婚吧，求你了,广东,0,24-昨天 21:33
1937,英语练习笔记,想吃绝户吃干抹净，还想有好名声呵呵,河南,1,24-昨天 21:33
1938,用户7732676882,老子真的无语了……你真是，我的妈，你真的绝了,湖北,0,24-昨天 21:33
1939,我会改昵称啦呀,离谱,山东,0,24-昨天 21:33
1940,大大萝卜鱼,想拉个群一起骂你，看完节目乳腺不通畅了,广东,1,24-昨天 21:33
1942,Ssida_she,第一次看到你和李行亮，我吓了一跳，没想到李行亮的老婆这么普通，甚至满脸横肉。我想你们一定很相爱，一定有故事。结果你如此一言难尽。你从德行、处理事情的能力、认知水平、情商、智商、心胸、气质、外表、工作、学历、才华、收入、社会地位、社会美誉度、家境、性格、身材等方面，全部被李行亮吊打,上海,3,24-昨天 21:32
1944,天儿凉了201901,多看点书吧，上个夜大啥的,河北,0,24-昨天 21:31
1945,王思琛,别折磨亮亮和大家了，跟客观，一点都不算网暴，没人欠你的，你敢不敢让100个人打分，看你能及格不,陕西,0,24-昨天 21:31
1946,我是金刚心,“就是你发没发现”，人家都是体面人给你体面和台阶一起哄你，人家都有素质，不代表你对，是受不了你了，只能让李哄好你,辽宁,0,24-昨天 21:30
1947,轻微小吹没有事,求求你了，离了吧,浙江,0,24-昨天 21:30
1948,等风来wonder,😑,上海,0,24-昨天 21:30
1949,AconeREace,你真好！好好的生活哦！,浙江,0,24-昨天 21:29
1950,Eternity0807,PUA 鼻祖,山西,0,24-昨天 21:29
1951,Csevenyii,不是 你在装什么啊🤔我受不了了,重庆,0,24-昨天 21:29
1952,xymmm1014,你是真的臭不要脸,北京,2,24-昨天 21:28
1953,一半214,我真服了，你到底要啥啊？？？你明确的说可以吗？别让李行亮猜了，我都心疼他了！！,山东,0,24-昨天 21:28
1954,CccllKOi,为啥要一群人哄着你 把自己不好情绪带给别人,福建,0,24-昨天 21:28
1955,春寄绵绵相思,麦林炮手,山西,0,24-昨天 21:27
1956,贝斯特的猫,觉得李行亮好厉害 跟这种人过十几年还没抑郁,北京,0,24-昨天 21:26
1957,Conrmceal,放过他,陕西,0,24-昨天 21:26
1958,限定小玺_,放过亮子吧，你跟杨子绝配,湖南,0,24-昨天 21:26
1959,幸有来山未孤,沙雕。呵呵呵,吉林,0,24-昨天 21:26
1960,一只短腿小猪,你真是个笑话,浙江,0,24-昨天 21:26
1961,吴可以zzz,6,江苏,0,24-昨天 21:25
1962,是婷ting婷婷啊,没文化没素质的臭垃圾,广东,1,24-昨天 21:25
1963,如戏之,没性格、没钱、 没颜、 没身材 哪来的资本这么搞自己伴侣呢？,山东,0,24-昨天 21:24
1964,人生海海_tamon,怎么可以看个电视这么生气！你真厉害！赶紧离婚吧，没有人配跟你在一起，你是最特别的！放过李行亮。你才四十岁，还有大把的年华，去找个高富帅，美美的开始新生活吧,福建,0,24-昨天 21:24
1965,用户7892203253,真作，真辣鸡,陕西,0,24-昨天 21:24
1966,你的天子,告诉我哪里能骂他[咒骂][咒骂],湖南,0,24-昨天 21:24
1967,一身贵妃肉儿,@一身贵妃肉儿: 感谢你，放过亮哥吧，你都对，他不配。你这样极品，地球都不配,天津,0,24-昨天 21:23
1968,Tammy谭瘦瘦,喜欢80自己老公，真有你的啊麦b,北京,0,24-昨天 21:22
1969,用户7408276109,一个没能力创造收入的人，在节目里和另外两个女人雌竞，你哪里来的底气，黄圣依，葛夕收入，性格，自理自立能力甩你一个星球，另外两对是男的有问题，你们这对你就是最大的麻烦，嘲讽老公，双标，情绪PUA，小伎俩，自己看节目知道你鬼样子吗？要不是拍节目别人都不愿意理你，对于不理你的你会当舔狗。,湖南,1,24-昨天 21:22
1970,哭包黄雨萌,你真作，看不见自己问题吗？脑子上的问题,海南,0,24-昨天 21:22
1971,flee677--,垃圾,四川,1,24-昨天 21:21
1973,哈内hello,救命，放过李行亮吧,北京,1,24-昨天 21:21
1974,未来未来95,为什么要精神虐待你老公,浙江,1,24-昨天 21:20
1975,5488噻,你太s比了,辽宁,2,24-昨天 21:20
1976,Gqhoshino,懒惰恶毒贪婪人品低劣,北京,1,24-昨天 21:20
1977,不想用头像,别人安慰你是因为你已经影响了节目进度，不赶紧稳住你节目都没法录了，所有人都得陪着你熬着，不是因为你是对的,山东,2,24-昨天 21:19
1978,漂靓宝贝121_,我从不在网上发表评论，这次实在忍不住了，你真是第一个，你坏的透顶，你是过街老鼠懂吗 吗麦批,云南,4,24-昨天 21:19
1979,皮卡丘烤排骨,放过我亮哥吧，你配用两三千的高质量生活,湖北,2,24-昨天 21:18
1980,听说长得帅的名字都长是吗,不是姐们，你指的杨子啊，你在叫什么啊，你就是烟瘾上来了吧,上海,2,24-昨天 21:18
1981,Brouciel,我澡尔冯,江苏,2,24-昨天 21:18
1982,Resurgence丶xy,肥头大耳,北京,1,24-昨天 21:18
1983,买到就是赚到_,你真的真的好讨厌啊你到底是呆家呆久了变这么讨厌还是你本来就这么讨厌,江西,2,24-昨天 21:18
1984,新嘉嘉大街,你可真是令人作呕,江苏,2,24-昨天 21:18
1985,想不出啥名字的,我直接可以用没教养来形容你,贵州,2,24-昨天 21:17
1986,小蜂蜜007,去看心里医生吧,福建,1,24-昨天 21:17
1987,买到就是赚到_,你真是一颗屎搅乱大家伙儿,江西,2,24-昨天 21:17
1988,哎呀陈陈,放过他吧,甘肃,1,24-昨天 21:17
1989,小蜂蜜007,我陪骂你一声吸血鬼吗？,福建,1,24-昨天 21:17
1990,豆豉雪姨,你好癫呀,辽宁,1,24-昨天 21:16
1991,文港清雅宣笔庄,你在意画作是吧！那你自己描述的自己呢，你没意识到还没他描述的好看吗？自己内心自卑作祟非要让人家背个锅是吗？人家是描述 你希望出来什么画作？美貌天仙？法令纹不谁都有吗 你爱笑 有法令纹 这不是常识吗！？,浙江,1,24-昨天 21:15
1992,阿卷吃好睡好,对 我也专门来看大家怎么骂的 真的不解气,湖北,1,24-昨天 21:15
1993,这个昵称希望你喜欢,人家五个人安慰你是希望你们俩和好，不是因为你对好吧，况且人家五个人要说你错你不又得发疯哭个没完,江苏,1,24-昨天 21:15
1994,一念甘心,让观察室嘉宾憋疯 全国观众愤怒和窒息的女主 出来走两步,江苏,52,24-昨天 21:13
1995,迪斯尼在逃劲夫,你赶紧离婚吧看见你就烦,广东,0,24-昨天 21:13
1996,橘子七z,PUA大师你好,江苏,0,24-昨天 21:13
1997,呆萌萌的小妞妞2020,太窒息了你,美国,0,24-昨天 21:12
1998,冰冰酱啊,你不离婚，天理难容！！！,江苏,0,24-昨天 21:12
1999,依依爱杨扬,天,湖南,0,24-昨天 21:12
2000,5488噻,你找个班上吧，别可李行亮折磨了，放过他吧,辽宁,0,24-昨天 21:11
2001,这个昵称希望你喜欢,答应我以后不要再上任何综艺了好吗,江苏,0,24-昨天 21:11
2002,知乐油画馆,你该s,河南,0,24-昨天 21:10
2003,知乐油画馆,你还s,河南,0,24-昨天 21:10
2004,原来是芋袁西米露,看了第六期上，你在想什么啊！！！太心疼亮子了，简直对牛弹琴…,江苏,0,24-昨天 21:10
2005,小MAO的日记本,熏鸡好吃吗麦总,北京,0,24-昨天 21:10
2006,柴可夫丨Tchaikov,谢谢你麦姐你让我知道了什么叫相由心生，你就是一头有着无尽贪婪的🐷,湖北,2,24-昨天 21:09
2007,TIITA,你是不敢面对你这多年在家的那一套作派吧！出来世界才发现别人真的没有你那么坏和蠢！你不愿承认不堪、不愿改变自己，于你最简单的事继续掌控唯一的操纵的对象-你的丈夫！当你的丈夫也开始反抗、醒悟的时候，你怕了，怕他以后再也不受你掌控编排，你就威胁离婚！他越是不离你越知道该如何拿捏他！,湖南,0,24-昨天 21:09
2008,R云雾,你找个厂拧螺丝吧,浙江,0,24-昨天 21:09
2009,哆啦b顺,人活着怎么能活得这么不体面,四川,0,24-昨天 21:09
2011,我不是辛德拉,过街老鼠,河北,0,24-昨天 21:08
2012,YIGEFZ,你为什么能这么低级 你太拿不出手了 你一点都不配得到李行亮的爱 因为你是个没有爱的人 你就是一个吸血鬼 你也一定当不好一个妈妈 快点离开李行亮和孩子吧,吉林,1,24-昨天 21:07
2013,Jeana--Wong,第一次在微博骂人，不骂你我就要结节了，太气了,云南,2,24-昨天 21:07
2014,宋文儿的胖橘子,那个你盯着的富豪老板看不上你的，快别老往人家俩那里凑了，还和人家美女比这比那，不嫌丢人,山东,0,24-昨天 21:07
2015,用户5622835564,你这种人应该被判刑,澳大利亚,2,24-昨天 21:07
2016,nc000987,不是说 活着走不出节目嘛？咋不去落实呢,上海,0,24-昨天 21:07
2017,打工牛马1号,就是想来骂你一下,福建,0,24-昨天 21:06
2018,Sylar_LH,我是来安慰你的，全是都应该来安慰你,上海,0,24-昨天 21:06
2019,Shallwe_not_go,不骂骂你我都要长结节，过于奇葩了，活在你霸道总裁童话世界里吧,江苏,0,24-昨天 21:06
2020,我还是会听姐姐的,你就是个烂人,北京,1,24-昨天 21:05
2022,L捡书,其他几个人都叫你老公来哄你，不是因为你有理李行亮做错了，是因为你哭了你是女的。还有一点李行亮十几年是怎么忍让到你变成这样的。,重庆,0,24-昨天 21:05
2023,好人华强,说实话，这些年李行亮真的亏欠麦琳很多，这么多年都没给过她一个大嘴巴子，麦琳实在太委屈了。,浙江,123,24-昨天 21:05
2024,Mac-nwfowlY,想给你一拳,四川,0,24-昨天 21:05
2025,韩咲悦,旁人都在安慰你，可你不自知李安慰你的时候有放在心上过吗？不停的作作作，既要又要只会毁了你的要真有魅力杨子给你介绍个给你买钻石买项链买包包的富商不成问题吧，可为什么要躲着你呢,山东,0,24-昨天 21:05
2026,风露晚,你看节目记得开弹幕哦～,江苏,0,24-昨天 21:04
2027,劳拉王者风范1101,真的对你很无语,福建,0,24-昨天 21:04
2028,进击的TANYA,吸血鬼🧛♀️,上海,0,24-昨天 21:04
2029,乔一井二,你应该看看知否，夫妻之间只要不在外人面前争吵，无论发生什么都还有体面。但是你在节目不停歇的争吵，丢脸丢到全世界了……永远都在吵，那为什么要在一起呢,上海,0,24-昨天 21:04
2030,磨人的大大大妖精,这期你自在了你让所有人都不自在了啊 天啊 是一个团队你在干嘛 你不要这么自私好不好 所有人都要为你服务看你眼色吗 无语啊 都是要四十岁的人了 我的天,重庆,0,24-昨天 21:04
2031,劳拉王者风范1101,珍惜他吧！是你有错一直无理取闹！,福建,0,24-昨天 21:04
2033,张茜1989,我为偶尔能共情你的自己而羞耻,江苏,1,24-昨天 21:03
2034,驻马店第二医院脑外科王主任,你好，请来我门诊,四川,1,24-昨天 21:03
2035,夏至-沫沫沫沫沫沫沫沫,好久没这么想骂人了，你太让人窒息了！关键是你的人品绝对的有问题！你人不行知道么！,北京,0,24-昨天 21:03
2036,啊雪依呀呀,……,广东,0,24-昨天 21:03
2037,蓟明钦2014__,麦麦你真感觉不到李行亮爱你？精心策划准备浪漫婚礼、打飞机买青团、千里剥虾送你、亲手做生日礼物…不知道不说。全国人民都被惊喜到了呀！,河北,2,24-昨天 21:02
2038,好丑丑丑丑6512077633,就焦虑退路，了，,山东,0,24-昨天 21:02
2039,jxiongya,哈,湖南,0,24-昨天 21:02
2040,___Zqq,我求求了赶紧离婚吧,山东,0,24-昨天 21:02
2041,Dakecrazy,劝和不劝离的大背景下，还是离了吧,福建,2,24-昨天 21:02
2042,P-atiencer,go die,上海,0,24-昨天 21:02
2043,大头大头下雨不愁222,离婚吧,安徽,0,24-昨天 21:01
2044,毛毛的真爱粉,我觉得你没有学过九年义务教育吧！有娘生没娘教，第一次见那么没有素质的人,四川,0,24-昨天 21:01
2045,P-atiencer,sjb,上海,0,24-昨天 21:01
2046,-GUMENG,不知道，为啥我觉得我年轻的时候比你漂亮多，我还是独生子女深二代，为啥没有那么多富二代追我？还是我不够优秀,广东,0,24-昨天 21:01
2047,Ireneeee_1,你别装了姐,广东,0,24-昨天 21:01
2048,好_Julia,姐，你大可不必活成人人都讨厌的样子，我感觉葛夕都不应该这么照顾你，只能让你得寸进尺…,广东,0,24-昨天 21:00
2049,毛毛的真爱粉,你自己一天无所事事搞得没有自我也想让李行亮变成你那样吧,四川,0,24-昨天 21:00
2050,今天祢又博学了嘛,求你了，离婚吧，放过亮子，你坐火箭提高你的生活质量吧,河南,0,24-昨天 21:00
2051,一等无知,你到底背负啥了，放过李行亮吧，离婚吧,广东,0,24-昨天 21:00
2052,兰宝llano,服了你 别在作了,广东,0,24-昨天 21:00
2053,啦啦一博,离婚又要小孩又要钱，你怎么敢啊,江西,0,24-昨天 20:59
2054,immmwinter,疯子,广东,0,24-昨天 20:59
2055,声声乌龙不加冰,妈的，看综艺感觉被网爆了，不骂一下难解心头气,江苏,1,24-昨天 20:59
2056,陌小鮮,不想过就直说，别折磨人,江苏,0,24-昨天 20:59
2057,啦啦一博,害，李行亮都成骷髅了，被折磨他了,江西,0,24-昨天 20:59
2058,糖爹哥哥,你想要的不是老公而是一个绝对服从的机器还要时不时给你惊喜,湖南,0,24-昨天 20:58
2059,李欣Lonikie,Sbsbsbsbsbsbsbsbsbsbsbsbsbsbsbsbsbsb，你放过李行亮吧！！！！！！！！,吉林,0,24-昨天 20:58
2060,檬小歪,看半截再骂一遍缓一缓,天津,1,24-昨天 20:58
2061,李欣Lonikie,Sbsbsbsbsbsbsbsbsbsbsbsbsbsbsbsbsbsbdsbdsbdsbdsbdsb,吉林,0,24-昨天 20:58
2062,ilin_7,不离 你不是人,福建,1,24-昨天 20:58
2063,ilin_7,离婚吧 你真得得去看医生,福建,2,24-昨天 20:57
2064,手机用户1957666675_814,我真服了大姐，我从来没在网上骂过人，你是真的能把别人的恶都激发出来啊，你真是太把自己当个东西，文化水平低素质低智商也低，你凭什么觉得你的想法是对的李行亮应该听你的啊，四十岁的人还看不清别人烦你不想和你这样麻烦的人起冲突吗，还真觉得自己有理了开始蹬鼻子上脸了是吧,安徽,5,24-昨天 20:57
2065,李欣Lonikie,Sbsbsbsbsbsbsbsbsbsbsbsbsbsbsbsbsbsb,吉林,2,24-昨天 20:57
2066,迈_迈,我 真 想 给 你 个 大 耳 刮 子 ！,北京,1,24-昨天 20:56
2067,小歪么么,看到这么多人在让你反思我就放心了,山东,0,24-昨天 20:55
2068,Fmfeve,你是什么农村出来的村姑么？怎么认知这么低。,英国,0,24-昨天 20:55
2069,哈尔er_,一次次的刷新对人类的认知,河北,1,24-昨天 20:55
2070,五亿个小铃铛der,你为什么要幻想出一个没有发生的人生啊？有钱的追你，你就能幸福吗？如果这么笃定，当时为什么不选择那样的人生呢？既然自己选择了这样的，反过来又要怪别人？别人到底欠你什么？,湖北,1,24-昨天 20:54
2071,卡丁喵儿,说的是动物的动物，你提什么草原动物。能不能尊重节目规则，人家夫妻一起，你老是要跟人家夫妻一起干嘛，动不动不录了，哭，我有点难过，录节目没签合约么，合着所有人都得哄你呗。,河南,1,24-昨天 20:54
2072,泠子Lieko,求求你多读点书吧，你在节目上的样子真的很可怜……一个情绪化的人，和原始人没有区别,四川,2,24-昨天 20:54
2073,可可可人_,有你在人家两对儿都不能认真离婚了，整个节目都是你你你,河南,1,24-昨天 20:53
2074,麻吉柯德,我就是来骂你、人怎么能不自知到如此地步、不要说我们网曝你、是你惹了民愤、把我气得前列腺都肿了,江苏,1,24-昨天 20:53
2075,雪山V姑娘,在李行亮说他的需求和真诚想法的时候，为什么你一直要索求，让人窒息,四川,0,24-昨天 20:53
2076,辰辰不将就,明明你的问题最大，不是谁哭谁有理,福建,1,24-昨天 20:53
2077,披着煎饼皮的羊,你这人本质真坏啊，把李行亮的钱还给他，然后赶紧离婚，快火箭去吧,黑龙江,1,24-昨天 20:53
2078,用户7916065292,真的低级，太低级了，垃圾女人,重庆,2,24-昨天 20:53
2079,美食侦探物语,你真是好男人不懂珍惜。,河北,1,24-昨天 20:53
2081,张达子123,你有自恋型人格障碍,上海,0,24-昨天 20:51
2082,她很天真i,你说的跟做的能一致吗？一直说感受不到李行亮的爱，又一直说自己爱他，爱他就得折磨他，让他一辈子对你愧疚，真的，也就李行亮老实，但凡他想通了，你就后悔去吧，你真是我看到最让我无语的人，我几乎从不评论别人，你是第一个,山东,1,24-昨天 20:50
2083,褪丶瑟,@褪丶瑟: 你脑子里是有包吧？,江苏,0,24-昨天 20:50
2085,第7页序ll,赶紧去离婚吧,广东,0,24-昨天 20:49
2086,桥北三楂,真是无语啊,安徽,0,24-昨天 20:49
2087,第7页序ll,李行亮真的太没尊严了 你把别人踩在脚下,广东,0,24-昨天 20:49
2088,NeilCheuk,真忍不住了！我也要来骂骂sorry！,浙江,0,24-昨天 20:49
2089,第7页序ll,有你这种人,广东,0,24-昨天 20:48
2090,C_Y_F_M_W,放过李行亮吧,福建,0,24-昨天 20:48
2092,J-near,论演技你超过了黄圣依，论装X你超过了杨子，论智商你超过了我家的狗,辽宁,1,24-昨天 20:48
2093,mfcfds,感觉这期播完，网友们能把麦琳撕碎,山西,0,24-昨天 20:47
2094,甜甜咖啡爱追剧,所以说你离了还是没离，,河南,0,24-昨天 20:47
2095,Moonie慕妮,你真的很可怕。广大网友的眼睛是雪亮的。你别再嚯嚯李行亮了。你真可怕。你快点离婚吧。,日本,0,24-昨天 20:47
2096,張JiangY_,洪金宝你真的很麻烦,北京,67,24-昨天 20:47
2097,第7页序ll,你疯了吧,广东,0,24-昨天 20:47
2098,是王二渔呀,放过李行亮吧,四川,1,24-昨天 20:47
2099,用户7459920434,没骂过人，你也是真可以，我真想撕烂你的嘴,北京,1,24-昨天 20:46
2100,回首向来萧瑟处_也无风雨也无情,珍爱生命 远离麦琳,江苏,2,24-昨天 20:46
2101,浪浪山小猪猪-,又唇又自私,四川,1,24-昨天 20:46
2102,30-70,这辈子没说过脏话 没骂过人 *** *******,江苏,0,24-昨天 20:45
2103,22儿儿儿,你真他妈一个令人窒息！你最自私了，还说别人自私,天津,0,24-昨天 20:45
2104,ethanchow_ff,你踏马真是个人才。,北京,0,24-昨天 20:45
2105,费洛蒙先生ai,要不去看医生吧,广西,0,24-昨天 20:44
2106,面包会有的啦_,你真的是一个非常自私自利的人，以自我为中心，丝毫不照顾他人的感受,安徽,0,24-昨天 20:44
2107,韩当舞w,你真幽默，自己说话没一点逻辑，抓住一个没道理的点无理取闹，哭哭哭天天哭，别去影响别人行吗，真烦人啊,广东,0,24-昨天 20:43
2108,张大笑96,姐，受不了了,浙江,0,24-昨天 20:43
2109,Tears_琦琦,垃圾人,江西,0,24-昨天 20:42
2110,潇潇雨歇-MikeXu,自私的不是别人，是你自己。不只是自私，还任性、双标、自我中心、无理取闹、异想天开。你这样的人，不配拥有爱。,北京,0,24-昨天 20:41
2111,今晚打火锅儿,你还是个人？,广东,0,24-昨天 20:41
2112,废物的无聊生活,6,湖南,0,24-昨天 20:40
2113,六十七与洗澡计划,1,北京,0,24-昨天 20:40
2114,-ey50735,真的太无语了，赶紧离婚吧，找个能受的了的人过去吧，而且你也没赚钱 平分财产就不错了，孩子抚养权问题就交给法院判吧，孩子也不一定受的了你这样的妈，好窒息啊,浙江,0,24-昨天 20:39
2115,美丽可爱的小文子,你不觉得你自己的行为很傻缺吗？人家夫妻上这个节目都是要有独处时间解决问题，增进感情的，你为什么一直掺合进别的夫妻里面？让人讨厌，要不你就别录了,天津,1,24-昨天 20:38
2116,哦唷OYO,但其实你哭也并不能引起我们观众的同情心，我觉得你现在的情绪不能很好的沟通，应该先冷静一两个礼拜再好好沟通一下，现在的你把李行亮当成敌人了，无论他说什么都是错的，真心建议你们彼此冷静一下在沟通,浙江,0,24-昨天 20:38
2117,阿湫呀-_-,太会PUA了不累吗这样,重庆,0,24-昨天 20:37
2118,鲤姜冯,臭傻呗,广东,0,24-昨天 20:36
2119,_宇鱼jlsy,姐你真是我的姐，我真要被你逆天思维发言送走了，你绝了没有比你更绝的人了,山东,0,24-昨天 20:36
2120,隔壁小老刘,专门下载来骂你的，但是过来感觉因为你这种人生气也不值得,内蒙古,0,24-昨天 20:36
2121,十八与他的情书,1,山东,0,24-昨天 20:36
2122,黑市商人_,真的好可怕啊 你快点改变吧 为什么要这样伤对方的心啊,江苏,0,24-昨天 20:36
2123,qdg缺点钙,生而为人，你不配！,山东,0,24-昨天 20:35
2124,是棒棒糖糖啊,你好可怕。你不爱李行亮更爱你自己！一直精神暴力道德绑架李行亮。跟你生活就像地狱 一不小心被点燃的地雷哄也哄不好。就这样李行亮还有功夫做音乐？你可拖垮他身体拖垮他心灵心力能量 也要拖垮他才华让他骨瘦如柴让他灵感枯竭！你是最大的问题而不自知！就像吸血的吸血鬼吸食能量负能量爆棚！,北京,0,24-昨天 20:34
2125,qdg缺点钙,说到做到，离婚吧！！！看的我火大,山东,0,24-昨天 20:34
2126,喜翻儿5,全世界都要围着你转 麦太太,重庆,0,24-昨天 20:34
2127,Yeebies白,？,陕西,0,24-昨天 20:34
2128,却念旧人,不是，没事瞎矫情什么，真没事找个班上，天天怎么那么多事,河北,0,24-昨天 20:33
2129,汝食吾屁香否,讲真，你能从鲨比进化到大鲨比，你身边的人功不可没，有没有可能大家“安慰”你……只是因为你听不进去人话，大家秉持着契约精神，莫得办法赶紧哄着你，赶紧翻篇，继续录制综艺节目呢,贵州,0,24-昨天 20:33
2130,卡卡不吃饭,离婚吧 不要折磨全球人民,贵州,1,24-昨天 20:31
2131,为什么又是周一-,你现在最重要的事情是专升本,浙江,1,24-昨天 20:31
2132,幸运的forward1956,你一直说你很爱亮哥，但一个你这么爱的人在难受，都说自己有心理问题了，你竟然那么无动于衷，说明你根本不爱。,广东,3,24-昨天 20:30
