comment_id,user_name,text_raw,source,like_counts,created_at
161,努力学力小阳,姐劝你早点离，真的不值得，杨子是节目四季以来我最讨厌的人，，，，节目播出两期，没看出他对你的一丁点爱，真想冲进屏幕打他,重庆,3,24-10-25 00:40
162,melody_Khalil,离婚吧姐姐你真的值得拥有一个更美好的人生,江苏,2,24-10-22 00:43
163,小糟糕啊,姐，离了吧，去过自己的人生。,山东,4,24-10-21 18:44
164,迷茫的sunsun,我把所有劝你离婚的，都点赞了,广东,3,24-10-21 01:12
165,内娱心动少年,坚强点,北京,5,24-10-20 15:10
166,暖小主1111,姐，你要相信自己，你是最棒的,湖南,5,24-10-19 14:51
167,Elyingr,姐姐，加油，能看得出你的决心一定要更爱自己，新的生活会更好的,湖北,4,24-10-19 13:51
168,小Z-小丫小小周,你真的很漂亮，希望你可以多听听内心自己的声音，勇敢的做出决定，这样的另外一半看着真的好窒息。,广东,5,24-10-19 11:52
169,穿上白纱裙的小妩媚,心疼你，女人 离婚。,四川,11,24-10-18 22:40
170,这个少女有点秃,姐，你的情绪是真的稳定，也太修养了，求你独美,福建,4,24-10-18 04:02
171,L澄橙澄,台湾总有一天会回归,湖北,16,24-10-14 12:50
172,elemmm,综艺只能看出来你爱他，看不到他爱你,江苏,2,24-11-2 20:58
173,清酒微凉007,姐姐呀你这么漂亮这么好看，你在想什么呀？怎么就被杨紫那个混蛋。灌迷魂汤就灌成这个样子呢？真的我看你有种就是有一种憋屈感，就看你和杨紫的婚姻有一种无力感和憋屈感，为什么你就不能反抗一下呢？为什么你一定要和他在一起，你清醒清醒吧，他就是pua你呀这种人要不得呀，可怕死了，他连孩子都不要,重庆,2,24-11-2 18:04
174,Alisonwang07,离谱 个人财产不知道 你是高知家庭里的 优秀女儿 你何必,北京,4,24-11-1 22:02
175,高溪蔓在奋斗,遇到这样一个人，已经困了17年了，要飞出去了姐姐,浙江,3,24-11-1 14:44
176,小余菜奈,别心疼了 人家心甘情愿 耍的就是吃瓜群众,安徽,5,24-10-24 18:45
177,内娱心动少年,怎么又不离了？,北京,5,24-10-24 17:11
178,季恋,姐姐离婚吧,陕西,2,24-10-22 19:01
179,小螺号嘀嘀嘀吹呀,不说别的，这么多年了，姐姐还是这么美，很久没在荧幕上看到姐姐，出现在再见爱人里，依然被姐姐的美貌打动,湖南,3,24-10-21 17:13
180,蓟明钦2014__,宠孩子惯孩子就是还害孩子，你黄圣依眼里只有安鳞没有乖巧懂事聪明伶俐的安迪就是你最大的败笔。至于婚姻你们也是各取所求罢了。老公可以不要孩子是自己的,河北,2,24-10-21 13:00
181,蓟明钦2014__,我就这么告诉你，你将来还是大儿子管你，小儿子让你养废了将来就是一个废物。,河北,2,24-10-21 12:57
182,七七-1027,赶紧离婚吧姐姐，这种男人有人格障碍，做自己！看的我真的好无语，好多个镜头真的想替你扇两巴掌杨子……,澳大利亚,3,24-10-21 06:55
183,斯染音,姐，快离婚吧希望看到你更多的剧,黑龙江,2,24-10-20 21:52
184,肉多多还是肉肉多_,离婚吧离婚吧,江苏,2,24-10-19 21:46
185,奶思兔米鱿fu,你值得更好的,重庆,2,24-10-19 17:01
186,是郁只玥玥猪捏,姐……你别想太多，离就完事了,辽宁,6,24-10-19 08:38
187,羽化成霓裳,求离婚,四川,4,24-10-18 13:59
188,Sunday小姐的花园,一定要离啊！找回那个闪闪发光的自己！,福建,4,24-10-17 23:21
189,大维iso,啊～～～～～你可是我们的女神啊～,四川,1,24-11-5 10:00
190,诩丞,真不值得啊，快离了吧,内蒙古,1,24-11-2 12:05
191,balance555,寓言小说《盔甲骑士》中，骑士对梅林说，他爱妻子和儿子，梅林反问:“你有没有把需要当作爱。”骑士恍然大悟，他需要去“爱”妻子和儿子。妻子和儿子只是骑士的爱的对象和工具而已。骑士只是想将自己的意志强加在妻子和儿子身上罢了。难怪，妻子和儿子都对他的爱没什么反应，因为这种爱其实是伤害。,辽宁,1,24-11-2 10:49
192,乖说爱我,加油！！！圣依！！！！,新疆,1,24-10-25 15:49
193,Vic乐乐超可,姐 快离婚独美吧,湖南,1,24-10-25 14:08
194,小雀斑er0000,圣衣啊 再搞个品牌啊 姐们帮你撑起来,贵州,2,24-10-24 23:29
195,少女秋_困困困,有点魄力，离吧，就给他打官司，起诉，耗就耗，过几年出一个自传或者直播，钱就回来了。说真的，他也看不上你，但是这个不是问题，问题是你不能在这个人身上把一辈子消耗了。你不是我们普通人，你离开他也能活的很好，孩子不用指望他，他教不了。不教还好，教坏了不就完了。沉没成本就沉没吧。,河南,4,24-10-22 18:56
196,泰迪pp携妻子coco,离婚还要考虑2个孩子呀，哪有那么好离婚,北京,1,24-10-21 16:53
197,章章不自律,抱抱圣依！,浙江,3,24-10-21 12:03
198,双双1666,依宝我支持你离婚，永远爱你,黑龙江,1,24-10-21 10:19
199,张岱,看了这个综艺，特别懂你,上海,2,24-10-20 20:45
200,蒙治月高能效益,姐姐好好的,广东,5,24-10-20 13:48
201,自由自在就很好,姐性格太好了，也很孝顺。他好大男子主义，好啰嗦，但是是还是希望你们能好好的。,云南,2,24-10-20 07:53
202,吃着甘蔗爬楼梯,姐妹离婚吧，找个小鲜肉多姿多彩的生活，把孩子扔给他，让他感受一下中国的传统文化有多难,山西,5,24-10-20 06:30
203,海燕small,姐姐，我还是支持你离婚，如果你不开心的话，不要勉强自己。我们永远支持你,贵州,1,24-10-19 00:44
204,Lily姚yy,你那么美，为什么要委屈自己。,湖南,4,24-10-17 23:22
205,kkkktttt猫,姐呀 你咋还不离婚呢 这么委屈 是想没苦硬吃嘛 清醒一点啊 难道离开了他 你没法活嘛 要清醒呀 看得我都替你着急,广西,3,24-10-17 22:31
206,高缘红城,只有一个中国。,山东,1,24-10-14 17:40
207,超有微微,只有一个中国。,山东,1,24-10-14 17:39
208,小魏小魏的小魏,祖国统一势不可挡。,山东,1,24-10-14 17:38
209,济超南伟,只有一个中国。,山东,1,24-10-14 17:37
210,忘忧草姜,我们只有一个中国。,山东,1,24-10-14 17:35
211,为之生命喝彩,只有一个中国。,山东,1,24-10-14 17:29
212,泰泓1989,只有一个中国。,山东,1,24-10-14 17:28
213,若欣欣欣子,只有一个中国。,山东,1,24-10-14 17:27
214,静静等等我吧,只有一个中国。,山东,1,24-10-14 17:23
215,旭日东升可,只有一个中国。,山东,1,24-10-14 17:20
216,无悔波波,只有一个中国,山东,1,24-10-14 17:19
217,米奇爱小妙屋,祖国统一，势不可挡,山东,1,24-10-14 17:17
218,大涛小涛老涛,只有一个中国,山东,1,24-10-14 17:16
219,太宏了,祖国统一，势不可挡,山东,2,24-10-14 17:13
