comment_id,user_name,text_raw,source,like_counts,created_at
1,夏飘儿ceci,一直不明白一个书香门第的大家闺秀，怎么会找一个那么油腻的商人，那么多年的婚姻他一直在把你当成摇钱树！你上了这个节目说明你早就已经认清这个人什么样了，离婚，做自己！,江苏,6112,24-10-17 15:05
2,想想还叫林小夕,跑过来劝离的，他利用你，但不认可你，他把自己描述成遮风挡雨的大树，把你说成攀附的无知藤蔓，他只是把你当做炫耀的资本，挣钱的工具，教子的保姆，他不爱你，也不认可你，更不尊重你。离开，做清醒大女主,北京,4707,24-10-17 18:10
3,展翅蓝飞,姐姐，你那么优秀怎么会感觉没有力量呀。我觉得你脾气真的好好呀，他好像一点都不心疼你，要参加浪姐的公演那么高强度的排练，还要给你接你不知道的工作内容。你们既是工作伙伴，也是夫妻。你完全可以提出自己的想法，想要接什么样的工作内容。,四川,2753,24-10-17 17:22
4,米莱小姐Milai,心疼一下圣依…修养太好脾气太好…这么过日子也是心累很久了,上海,1932,24-10-17 15:44
5,卞有钱ing,一直以为黄圣依是那种很聪明有心机的女生，看了再见爱人，才发现完全误会你了，只是长得很精明的样子，其实真的很温顺很有修养，不过杨子真的太表演型人格了！,陕西,1769,24-10-17 21:18
6,冰啤酒与猫,一个凌晨三点能去不顾及你的休息，去吵醒你的人，他一定不爱你。他不仅不爱你，还否定你，不在乎你。孩子也不会幸福的，一直好奇优越的家庭里的安迪为什么会有种自卑的性格，这种打压的父亲，孩子能自信才怪！,上海,1537,24-10-18 00:29
7,嘻xxx,姐啊，先甭一个不一个🇨🇳了，咱就是说，那么个大撒批…给你座金山你也得跑啊。。。太特么奇葩了真的卧槽 看得我要发疯。你太稳定了卧槽,北京,1009,24-10-18 17:26
8,sandi_无用心,以前错怪你了，你真的很好，快离开爹味很重的懂王，开始自己的生活事业吧,甘肃,808,24-10-17 18:46
9,一只奋斗小青年L,老天爷啊 姐姐不离婚等啥呢？ 醒醒啊,澳大利亚,713,24-10-17 19:25
10,夏飘儿ceci,真的，离婚吧，别跟这种男人过了！活出你自己！,江苏,656,24-10-17 15:04
11,国王大椰子,姐 求你赶紧离了吧 你的好日子才刚开始啊,新加坡,374,24-10-17 21:40
12,瓶子楠_,姐姐，你很棒啊！有能力有工作有孩子有美貌，你怕他干啥！离开他你也一样可以绽放！所有捆绑都是来源于你的内心！离开他你一定会更好的！去感受真正的爱情！,山东,333,24-10-17 20:29
13,来电面具,黄圣依，离吧，太憋屈了，对自己好点！,江苏,303,24-10-17 22:43
14,我今年身高168,你的边界感被入侵的很严重,澳大利亚,277,24-10-18 00:15
15,一把_牙刷,赶快跑 赶快离 需要帮你报警吗,云南,256,24-10-17 23:36
16,尧尧可在,我们只有一个家，名字叫中国,山东,178,24-10-14 12:54
17,我是马女亭,姐姐我关注你就想说一句话：为自己活，这个婚姻太窒息。,陕西,215,24-10-17 23:07
18,莴還賳請窦初开鍀哖纪,只有一个中国,广东,123,24-10-14 12:36
19,Dribly,只有一个中国，但也只有一个黄圣依。把自己当人吧，还来得及,湖北,172,24-10-18 01:44
20,太阳出山66552,他利用了你，还不感激你！还认为这是你应该做的！,陕西,167,24-10-18 00:33
21,圈范子,只有一个中国！,山东,104,24-10-14 13:06
22,什么时候可以不头疼,姐姐，求你离婚吧,河南,174,24-10-17 20:59
23,程程大小孩,只有一个中国！🇨🇳,山东,95,24-10-14 13:05
24,居然不知_,黄圣依，你不是小鸟，你本是展翅高飞的美丽的鹰！你是我的女神啊，看透他，就离开他吧。你的世界应该更辽阔，更精彩！他不是你停靠的树，是紧紧缠绕你翅膀的藤蔓！,河南,132,24-10-18 13:13
25,想上班摸鱼还有钱,姐，离婚，不要管什么捆绑利益这些，人生短短才多少年，但你的人生已经过去了一大半都是你不快乐的日子，剩下的时间就让自己怎么开心怎么来，你只有在未来的日子里没有这个男人的存在才能让你找到点快乐了。,内蒙古,117,24-10-18 08:06
26,一米阳光是几度,只有一个中国,山东,68,24-10-14 14:07
27,唯_心7099,姐姐，离吧！出苦海，做自己,河北,101,24-10-17 22:52
28,鱼記V,上海女人都是家里主心骨，是一家之主…你能支棱起来伐？你看看其他上海籍女演员，哪个人像你这样卑微…就因为他有钞票？有D骨气，离开个只戇男宁！,上海,128,24-10-18 07:55
29,若如初见_初心,浪姐上一定也交了一些圈内朋友，多参加综艺展示自己的性格（转变大众印象），多交朋友互换影视资源。演员立身之本永远是作品，是出彩的角色！好作品的累积，提升路人缘，尝试改变自己的性格和气场，到时候离不离都有了自己的“底气”，二选一，要么他改变相处方式或者你直接换人！,黑龙江,92,24-10-18 11:55
30,AAA贝斯批发凉老师,扬子比你自卑，所以他是故意让你丢掉了你身上真正厉害的地方，那是你自信的来源，等于折断了你生存飞翔的翅膀。。。。赶紧清醒点，人的一生应该为了自己开心的事情而活，活的那么表面风光有p用,福建,121,24-10-18 09:13
31,水冰月69174,杨子离不开黄圣依这个摇钱树，现在出去谈生意还能说我是黄圣依老公，如果离婚了，就只剩一张嘴，所以哪怕分居这么久，也不离婚！！ 为了让黄圣依不闹离婚，就各种pua她，给她洗脑！真坏,美国,102,24-10-18 03:31
32,张元圆zyy,呜呜呜呜姐姐离了吧仙女太委屈了,广东,92,24-10-17 19:36
33,豆-儿_豆,希望能尽早看到你们已经离婚的消息，求求了,广东,71,24-10-18 21:26
34,七七的一口时光,圣衣姐姐，希望你逃离杨子那个老登，你明明那么优秀，被他pua 的都快没有自我了,四川,77,24-10-18 20:27
35,DIDCIC,幸福真的不是钱有多少,辽宁,71,24-10-17 20:02
36,张小爬9,姐 离婚吧 看着都让人心疼,广东,66,24-10-17 22:16
37,梦儿0818,跑过来劝离的，他利用你，但不认可你，他把自己描述成遮风挡雨的大树，把你说成攀附的无知藤蔓，他只是把你当做炫耀的资本，挣钱的工具，教子的保姆，他不爱你，也不认可你，更不尊重你。离开，做清醒大女主,浙江,63,24-10-18 01:50
38,陈美嘉jia,他真的不配啊啊啊啊心疼姐姐,湖南,63,24-10-17 23:42
39,所想非想,还有，你交大附中的！！！上海顶尖公立四校！！你叫杨去考考看！说你没文化！太气人！,湖北,61,24-10-18 13:50
40,月亮禾水,姐姐离开他！自己选剧本，别被pua了，被他签约之后一部出圈的作品都没有，还不如自己发展呢,江苏,41,24-10-19 02:47
41,禾火you,姐，小时候看天仙配就觉得你可美了，这种窒息的婚姻，能离就离了吧，观众都支持你离婚，你要是离了，前途会更加好的，没必要把未来的生活也浪费在这段婚姻里,山东,31,24-10-20 00:55
42,张玲race,希望能早点看见你离婚的消息，求求了 姐姐赶紧离吧,广东,51,24-10-18 23:00
43,照常达不溜,姐姐，当时浪姐的时候当时我们分析的那些问题，终于你也意识到了，真的很为你开心，但是真的离了吧,山东,30,24-10-18 12:36
44,向日葵Jennifer_,不具备流通性的钱不叫钱，张泉灵老师说的,江苏,42,24-11-2 07:41
45,君君挚爱宝,只有一个中国,山东,32,24-10-14 13:02
46,连良菌,姐姐。离婚吧。是个人都不受不了这男的。,辽宁,38,24-10-19 01:25
47,小liao又困_,劝离 女神 我真的感觉你太压抑了,贵州,32,24-10-18 21:15
48,Alisha___,离婚吧姐，太委屈你了，他不配,上海,39,24-10-17 21:55
49,是一颗糖·Tang,离吧！名利都有了，该追求自我，享受对等的爱情了，他配不上你，打压式的婚姻旁观者看着都窒息，后半辈子为自己而活！,湖北,30,24-10-18 14:32
50,buduwhbsqkk,姐姐，站起来，去推开那扇门，外面是无比新鲜的空气,江苏,19,24-10-19 10:14
51,吖啾是天使,你太令人惋惜了！可以和周星驰解约，可以不当星女郎，你也可以发光大放光彩的！这么多年，你跟了个啥人！姐姐太可惜了！,山东,26,24-10-17 22:37
52,--荣公子--,如果有一个人天天打压我，我是一天也过不下去的，为什么，因为他不欣赏你，如果一个人不欣赏你，他怎么可能尊重你，如果没有尊重，怎么可能有爱，希望姐姐做最美的自己，为什么那么聪慧的水瓶座看不明白，真的气死我了,广东,22,24-10-18 01:35
53,伊雯2014,你与扬子的合约合适到期啊？你不离开这个人你这辈子很难幸福。你一定会遇到一个真心爱的把你放在第一位的人。很早就觉得早年他就是把你当摇钱树，这个人会消耗你的生命。,加拿大,23,24-10-19 05:01
54,bnnlyf,姐，求你，离婚吧！！！！！！！婚姻出问题虽然说彼此肯定都有责任，但是他不正常啊！！！！！！,上海,26,24-10-18 01:33
55,小小小小小幸运儿_,杨子这种喜欢长篇大论，答非所问，不知所云，喜欢显摆，没有担当的人，做他身边的人都是种灾难，不管是作为配偶还是下属亦或是事业伙伴，赶紧远离吧！,广东,30,24-10-19 09:57
56,梦儿0818,姐姐你真的很漂亮，有能力知名度有作品，跟他在一起太不开心，姐姐独美啊,浙江,26,24-10-18 01:51
57,即墨_199,宝贝，要爱自己。要把自己放在第一位。远离渣男，远离杨子,广东,13,24-10-19 13:49
58,檀迷心智,姐 实在忍不住了咱离了吧！对你对孩子都好，某某爱当霸总自己当就行了，你跟娃两个人和和美美,广西,18,24-10-19 22:53
59,他今天又没理我,姐，赶紧离婚真的！！！！,四川,16,24-10-19 15:59
60,美式无奶多冰,真不行 我们帮你报警,河南,23,24-10-18 00:17
61,糊糊T呼-,姐，独自美丽吧,江苏,28,24-10-17 22:12
62,Lit-mall,答应我 离婚,浙江,22,24-10-19 14:11
63,瘦到叭叭,姐姐！！！！离了吧你值得更好,福建,19,24-10-18 23:59
64,mateo袋袋,姐姐独自美丽吧，真的太让人心疼了,安徽,10,24-10-18 17:47
65,越陌度阡_嗷嗷嗷,真的没想到，在外桀骜高冷的大女主，在家里竟然像个傀儡一样姐，要么勇敢离婚寻找真正的自己，要么想开一点丧偶婚姻反正有钱花就行是不,山东,14,24-10-18 09:38
66,小风子哇,十七年婚姻生活，不敢想象我最喜欢看的《天仙配》现实生活一地鸡毛，你受了多少委屈和pua，节目播出，我光看都要气炸了，可以说“忍”应该贯穿了你的整个婚姻，佩服，不想多说你的另一半，有心的人都能看出所以然。多爱自己，敢于拒绝，你真的很不错了,江西,17,24-10-17 23:08
67,就想换个niches,气死了，姐姐，就两个字，离婚！！！！！！！,浙江,18,24-10-18 19:24
68,冷兔不乖,姐你脾气太好了心疼你,浙江,23,24-10-17 15:51
69,一抹暖阳-------158,你怎么能没有私人资产，太可怕了，就别的还能忍的话，这不能忍啊，别的也不该忍，可是这么多年你竟然没钱，快醒醒吧，你如此优秀，还来得及做自己好吗独自美丽,辽宁,17,24-11-2 08:47
70,踏破荆棘之地,一个男人。你应该看他做啦什么，而不是说的什么。你不觉得他在给你画个又大又圆的饼嘛。这个饼包括说什么哎呀我死啦遗嘱也会写你。但你怎么能相信呢，相信一个连财产都不交给你打理，密码也不告诉你，言语上轻视你的老板？你们不是夫妻吧他到底是你老板还是你丈夫。,四川,10,24-10-31 21:51
71,沉淀198111,黄圣依能不能学学人家章子怡，离婚搞事业，反正孩子也大了，现在正是离婚搞事业的好时机,山东,18,24-10-20 07:59
72,黑猫警长_199001,快离婚吧。我都看不下去了,上海,13,24-10-19 07:47
73,幸福的leilei的小屋,心疼黄圣依，可是黄圣依不懂心疼自己。,北京,16,24-10-19 21:21
74,来电面具,离吧！对自己好点，这老男人是油腻天花板！,江苏,16,24-10-18 07:51
75,红豆小姐-yuri,醒醒圣依！（家人们快让她清醒过来,美国,8,24-11-2 09:21
76,Lemon_mini娜,姐姐啊，你是嫁了个什么东西啊,广东,20,24-10-21 22:27
77,起什么名aaaaa,建议你了解一下npd人格，这种人真的碰不得，赶紧跑吧，做一个自私的人，抓不住的就放，赶紧跑吧，不然后半生也很难快乐，除非你等孩子长大了带着你出去生活。但这真的很难熬吧......哎反正都是自己的选择。只能说npd真的很恐怖，光看节目都能感觉非常的窒息，更别说跟这种人生活了。,陕西,14,24-10-20 02:11
78,白6788,姐，太惨了，不行咱就离归来依然是顶流,湖北,18,24-10-19 16:56
79,mandy的美好生活11,看清杨子，他不是为你哭和流泪，也不是为感情！是后悔上节目，是觉掌控不了你了，也控制不了舆论！他完全看不到自己的缺点@黄圣依,上海,9,24-10-21 11:33
80,水墨棠邑,看看人家赵丽颖敢爱敢恨，清醒独立，当断则断，否则反受其乱。你老公完全都是一直在利用你，Pua你，根本不爱你，不尊重你，把你当作附属品和工具，太让人失望了，他那种精致利己者虚伪的嘴脸让人心生厌恶！特别喜欢NPD表现自己特别聪明伟岸，把别人都当作智商低下的傻子。,北京,18,24-10-20 22:46
81,莫西莫2,懂王的眼里只有利益，你除了陪他直播带货外，你在他眼里已无利可图。清醒点，我们可以骄傲的离开，也别卑微的苟活。,浙江,10,24-10-20 08:53
82,CiCi阿晨,你的能量真的被他吸干了耗干了，希望你没有抑郁，不止是现在为了孩子，以后也是，不要抑郁。你的孩子可以没有爸爸的陪伴和教育，因为一个如此不堪的人来教育你的孩子那才是错误的，男孩子长大了需要一个男人来引领他没错，但这个人不止是爸爸。,河南,14,24-10-21 21:33
83,摩利支天如强,杨子爱黄圣依，但又自卑觉得配不上黄圣依，所以经常打击贬低黄圣依，让自己能配上黄圣依。千万不要离婚，要在婚姻中成长。,山东,6,24-10-19 12:34
84,豆本豆1101,一直以为你心机重。没想到你单纯简单孝顺有教养。情绪稳定。太好的女孩子了！为了自己开心，我认为你可以离开！,浙江,14,24-10-18 09:20
85,萍儿_yyp,心疼你姐姐,重庆,8,24-10-21 13:28
86,木子欣YI,他连做父亲的责任都没有尽到，丈夫的责任更是没有，对家庭没有尽心的人，对你和孩子没有爱，只有指责，离开吧，放过自己的后半生,山东,14,24-10-20 22:44
87,Mansyun_Wong,看了评论区很满意 姐姐 听听劝吧,江苏,12,24-10-20 20:24
88,嗑糖的小美,离婚吧,山西,10,24-10-20 16:27
89,JTTSSSoulmate,姐！离婚,湖南,15,24-10-20 13:57
90,柚子不是Z,姐姐 求你了 离了吧,湖南,9,24-10-20 02:30
91,-费雪小海马,姐 离婚了马上粉你,辽宁,9,24-10-19 19:59
92,屿与星,姐姐，你独美不好吗？带着孩子离吧，反正他也不管孩子，自己把工作主动权拿回来，好好去做自己喜欢的事吧,广东,12,24-10-18 01:44
93,dreammeerrrrr,姐出来拍戏搞事业,广西,13,24-10-17 21:38
94,木棉199816,姐姐，求你了离开他吧，可以听一下第三期黄执中老师说的话，一直在被他pua，慢慢的丧失了对自我价值的肯定，你的价值不需要他来肯定，你就是你自己。黄执中老师说的真的很好，“所有真正的觉醒都是对于价值的觉醒而不是对目标的觉醒”，可以尝试一点点的反驳他，让你看北斗七星的时候你就甩手离开不看,福建,7,24-10-31 20:34
95,--努力活到退休,姐求求你去拍电影电视剧吧离老男人远点,广西,9,24-10-20 12:55
96,See马拉雅山,来劝你离婚的，你书香门第，父母一家都那么优秀有涵养，你看你老公是个神马玩意！你明明可以有更好的前途，快离婚吧，别再继续放弃自我，在杨子的泥沼里磋磨自己了！还有两个儿子要一样的爱哈，我感觉安迪都不那么自信了！最后，天秤座的我要是遇见杨子这样的我队怼的他说不出话来，你就是太温柔惯着他,广东,10,24-10-21 14:22
97,莫妮卡贝鲁mememe,支持姐离婚的站队,山东,13,24-10-20 18:26
98,_离不开鱼的水_,操心的发表点我自己的看法，这个舆论风口上，你只能有破釜沉舟的勇气，离婚，打造独立女性人设，重新开始。要是不离，你大口碑会很差，而且杨会更加防备你，你靠自己赚的钱也拿不到。扬子明显生气别人对他的评价，节目播出可能更是暴躁，希望你能拿到你应得的利益，重新自己组建工作室,美国,17,24-10-20 12:28
99,王总不生气,求求你了 能不能离婚啊杨子根本配不上你 方方面面的配不上,上海,8,24-10-20 01:34
100,薛定谔的猫17201208,人生只有一次，勇敢的去做就行了，再勇敢点！踹了他,广东,9,24-10-19 22:52
101,楚江花月夜,只有一个中国,山东,1,24-10-14 17:18
102,youme598,离婚吧！离了以后会有很多人关注你，你的流量就来了，你的工作也就来了，工作来了，钱就来了！！！你想想离婚的女明星，是不是工作越来越多了，事业粉很多的，加油,江苏,15,24-10-20 19:56
103,Esther-2006,姐你独美,广东,10,24-10-18 16:57
104,啦啦啦呆姐,我看了一些片段睡不着觉，平时没主见没自信，然后被不尊重了甚至pua了也是钝感力十足，每次都是自己成全自己希望你能够开心生活，最重要的是别憋出病来，女人一般都是心情或者神志方面薄弱会容易得大病,陕西,9,24-10-18 03:28
105,CL_今時,赶紧离吧 太不值得了,北京,11,24-10-18 02:40
106,我今年身高168,你太能忍了！希望你可以找到自我！你的生活你自己说了算！,澳大利亚,11,24-10-18 00:13
107,今天不吃晚饭呀,真的看的我太难受了啊啊啊啊姐姐快离婚,广东,8,24-11-1 23:56
108,季恋,姐姐一定要坚持离婚啊,陕西,10,24-10-20 14:34
109,最爱甄嬛传,姐你清醒一点！！早点离婚！没了他你的生活你的事业只会越来越好，不管孩子的男人真的很差劲很差劲，他配不上你！,安徽,4,24-10-19 02:00
110,ZenLezer,真的//@卞有钱ing:一直以为黄圣依是那种很聪明有心机的女生，看了再见爱人，才发现完全误会你了，只是长得很精明的样子，其实真的很温顺很有修养，不过杨子真的太表演型人格了！,北京,8,24-10-18 18:04
111,暴抱小雨,离吧，找个清爽的,北京,9,24-10-18 15:20
112,圆圆脑袋zzz,姐姐 离婚吧,浙江,7,24-11-1 22:52
113,小麻啵啵o,支持姐姐离婚复出！你的功夫和天仙配一直是我的白月光,江苏,5,24-10-25 12:48
114,荠麦青青p,如果你不离婚的话，我以后一定变成黑粉，枉我真情实感同情你这么惨，没想到一个愿打一个愿挨，什么锅配什么盖,北京,7,24-10-24 20:27
115,SY生如半夏,以前把你当赚钱的工具，现在你没商业价值了，觉得你没用了，还是他撑起整个家！这些年在你身上赚的钱他觉得是他的功劳,湖北,9,24-10-24 20:01
116,阿星猪猪,姐看了再见爱人，感觉你性格特别好，以前真是误会你了，别再喜欢这个人了，看看人家韦雪,浙江,7,24-10-23 21:13
117,蓟明钦2014__,以前看你对大儿子安迪的态度如同一个继母，对你狠的牙痒痒因为安迪太好了。如今看你是真可怜……善待大儿子离开有名无实的丈夫。,河北,5,24-10-21 12:56
118,尘埃落于西,圣依加油！你值得拥有美好的新生活,西班牙,4,24-10-20 16:19
119,happyxy1108,离婚吧你很棒！,福建,6,24-10-18 01:02
120,伊芙琳_y,一定要把钱找回来 然后离婚吧,山东,11,24-11-2 10:51
121,叮铛麻麻1372,明摆着利用你呀！圣衣！你清醒点！这么多年你挣的钱自己怎么能不知道挣了多少呢？这个男人还把你挣的钱拿去弄什么收藏！这节目看得我气死了！你清醒点呀！,四川,9,24-11-1 13:21
122,小超人的保护伞,额。。虽然感觉是剧本 到看了之后真的是生理反应觉得恶心。 完全就是pua，如果是按照剧本拍的那真的是恶心。。如果不是，觉得你好惨,贵州,8,24-10-25 21:54
123,宇光十色202008,吃点好的吃点好的,广东,6,24-10-25 09:54
124,Silvia_Hou81,我真求求了，离吧！你有没有想过你如果没有选择他你会过什么样的人生啊？我可以很肯定地告诉你，绝对比现在过得好。他能给你的物质条件你通过自己努力也不会差的。你知道你自己在浪姐里多么光彩夺目吗？世界很大，你很优秀。那个男的只爱他自己。不要再浪费自己的人生了。,浙江,7,24-10-25 02:04
125,红泥小火炉WLM,你有教养，尊重他，不看他手机，但他缺乏教养啊，只会觉得你软弱可欺，一直拿捏你忽悠你。几十天的节目不可能改变一个人，回到现实还会那副德性，若真心想离就没离不掉的婚！,上海,10,24-10-24 11:31
126,内娱心动少年,快离！,北京,7,24-10-21 13:53
127,迷茫的sunsun,你一定要离婚啊,广东,3,24-10-21 01:11
128,繁星流眼泪,加油，离婚吧,江苏,8,24-10-20 17:59
129,幻昼721,活出你想活的样子吧，别再被PUA了,广东,8,24-10-20 17:59
130,头上有犄角呀巴扎嘿,离婚吧 窒息,江苏,9,24-10-20 00:33
131,树莓派小金最甜啦_,求你了姐 分了吧,重庆,6,24-11-2 20:12
132,G_Family_S,姐姐 独美吧,山东,2,24-10-21 20:08
133,D董叁岁,姐你脾气太好了,广东,7,24-10-18 22:41
134,老王来打野,只有一个中国。,山东,1,24-10-14 17:42
135,亚依林子,我们只有一个中国,山东,2,24-10-14 17:11
136,禾木之香,只有一个中国,山东,4,24-10-14 16:43
137,娱露晨荷,祖国统一，势不可挡,山东,3,24-10-14 16:40
138,荣归故之里,只有一个中国,山东,11,24-10-14 13:00
139,是枝hapz,离婚离婚 必须离婚,湖南,3,24-10-24 23:58
140,孤独依月,多多爱自己，你值得更好的,北京,7,24-10-24 21:50
141,Hitomi_允允子,对不起姐姐，浪姐的时候黑你了你是好人，值得更好的,新疆,3,24-10-22 15:19
142,G木兰,杨子要是没钱，就离哇！谁家也不缺祖宗？喜欢你的人可多了，现在开始不晚,内蒙古,3,24-10-21 15:26
143,汉南洞脸赞路人,听劝 离了吧,北京,10,24-10-20 15:24
144,克Li斯毛,离吧姐,黑龙江,6,24-10-19 19:42
145,米莱小姐Milai,一期一劝啊……醒醒吧！变成藏品？一是假货多，二是价格水分多，三是交易难…你还同意？不如咱们及时止损？要求他折现分一半给你先？你要手里有自己的钱啊……宝宝！现在开始赚的钱不能再让他保管了呀！,上海,10,24-11-2 11:37
146,若如初见_初心,他离了你毫无影响，甚至可以不考虑孩子。所以他不尊重你。你还对他不舍留恋他什么呢？？？人终究是要长大的，《是心理上的成长》，学会不再依赖别人《心理上的依赖》。。完成自我觉醒和自我成长，变成更好的自己！向内求，不要向外求，不向他人索取。现在纠正错误还不晚，人生可以有新的活法。。,黑龙江,1,24-11-2 00:45
147,内娱心动少年,怎么又不离了,北京,1,24-11-1 14:04
148,心里有星星nl,就是观察员说的，你现在的状态就像温水煮青蛙，他在慢慢消耗你的能量，看了这个节目真的觉得他太可怕了，觉得你太能隐忍了，20岁你不懂，你都40了应该有自己的独立人格和一套价值体系，什么是对什么是错底线是什么心里应该清楚的，老登就是太了解你了，知道怎么拿捏你，还1.18回归家庭，太荒唐了！,浙江,7,24-10-25 23:08
149,抓住一缕思念,不要被Pua哪怕他不要孩子你就自己带，都那么大了，就花点钱呗，孩子不全是你的软肋，只要迈出第一步，其他的都好解决，让他随便闹，只要离得彻底，必须彻底，不给对方藕断丝连的机会。,辽宁,5,24-10-24 07:38
150,k9186,看不下去了，赶紧离吧！你很优秀，一定能扛得住,浙江,11,24-10-19 23:32
151,汉南洞脸赞路人,离了吧,北京,6,24-10-19 23:03
152,暗恋是朵曼陀罗,姐啊，赶快离婚吧,河南,6,24-10-19 15:49
153,豆-儿_豆,赶紧离婚吧，真难顶这男的…,广东,7,24-10-18 18:31
154,停止掉发,如果不是演的，离婚吧,江苏,4,24-10-18 11:35
155,2067cb,姐，你真白长了一张精明的脸，心疼,河南,4,24-10-17 22:48
156,码上开森,坚持一个中国原则,北京,8,24-10-14 15:58
157,love二老猫,上个节目就知道傻笑，个人资产都没有也都不知道，对方完全看不到你的价值，你的价值只有商业的，你图啥？图他当初帮你付违约金，白活，看了节目真的觉得你是傻白甜？不可思议，看看嘉宾们的表情和态度吧,中国台湾,4,24-11-2 13:43
158,Love茉莉hu,你老公把钱都转走了，你要离婚真的是净身出户了，天呐,浙江,8,24-11-1 15:10
159,有只小小的桃子,姐姐，你知道什么是pua吗,河北,7,24-11-1 13:00
160,小秦冒險記,我看不懂你了,广东,3,24-10-25 11:04
